Регистр,Нэр,Хаяг,Бүртгэсэн_огноо,Үйл_ажиллагааны_чиглэл,Хувьцаа_эзэмшигчийн_тоо,Хувьцаа_эзэмшигч_гишүүд,Итгэмжлэлгүйгээр_төлөөлөх_албан_тушаалтан,ИТАТ_бүртгэсэн_огноо,Эцсийн_Өмчлөгч,ЭӨ_бүртгэсэн_огноо
3009661,Хүүшийн гозгор,"Архангай, Эрдэнэбулган, 3-р баг, 1, 11",2015.12.11,"Хот хоорондын ачаа тээвэр, ",1,"Цэрэндорж.Дорждэрэм, ",Цэрэндорж.Дорждэрэм,2015.12.11,"Цэрэндорж.Дорждэрэм, ",2020-10-16
3510697,Магнайн булаг,"Завхан, Цагаанхайрхан, 3-р баг, Баянбулаг, Хөдөө",2021.12.16,"Эрчимжсэн мал аж ахуй, Малын тэжээл тариалалт, үйлдвэрлэл, Малын үржүүлэг технологийн нэгжийн үйлчилгээ, Газар тариалан, Малын гаралтай түүхий эдийн бэлтгэл, боловсруулалт, худалдаа, ",9,"Шагдар.Батболд, Батэрдэнэ.Уртнасан, Нармандах.Өнөрсайхан, Батэрдэнэ.Намсрайжав, Пүрэвжав.Баянжаргал, Сумъяа.Гансүх, Норжмоо.Батнасан, Цогзолмаа.Дамдинпүрэв, Мягмаржав.Баяндалай, ",Цогзолмаа.Дамдинпүрэв,2021.12.16,"Батэрдэнэ.Уртнасан, Батэрдэнэ.Намсрайжав, Цогзолмаа.Дамдинпүрэв, ",2021-12-16
6806155,Мандах эрдмийн гэрэл,"Улаанбаатар, Хан-Уул, 4-р хороо, вива сити, 3/12, 5-5 тоот",2022.01.07,"Бүх нийтийн боловсролыг дээшлүүлэхэд хувь нэмрээ оруулах, шинэлэг, үр дүнтэй боловсролын арга барилыг түгээн дэлгэрүүлэх, сургалт семинар зохион байгуулах, төсөл хөтөлбөр хэрэгжүүлэх, ",3,"Ринчинлхүмбэ.Энхжаргал, Жанлав.Байгалмаа, Жанлав.Одончимэг, ",Жанлав.Одончимэг,2022.01.07,"Жанлав.Одончимэг, ",2022-01-07
3562492,Баян цэхч хайрхан,"Өвөрхангай, Арвайхээр, 8-р баг, Рашаант, 342, 9",2016.03.16,"Гадаад худалдаа, Дулаан үйлдвэрлэл, Ус түгээх үйлчилгээ, ",1,"Баясгалан.Энхзаяа, ",Баясгалан.Энхзаяа,2020.05.01,"Баясгалан.Энхзаяа, ",2020-05-01
2161109,Мандал буянт дэлгэрэх,"Хөвсгөл, Арбулаг, 5-р баг, Тарган нуур, 0",2006.05.02,"Мал эмнэлгийн үйлчилгээ /2001.04.25 - /, Малын эм, эмнэлгийн хэрэгсэл импортлох, худалдах / - /, ",2,"Цэвэгдорж.Алтанчимэг, Жүгдэр.Даваа, ",Жүгдэр.Даваа,2006.05.02,"Жүгдэр.Даваа, ",2020-09-22
3499189,Дуртмал-Алтан,"Завхан, Улиастай, 1-р баг, Жинст, Алтан үйлчилгээний төв",2013.10.31,"Машин, тоног төхөөрөмжийн бусад худалдаа, Гадаад худалдаа, Зочид буудлын үйлчилгээ, Цайны газрын үйлчилгээ, Зоогийн газрын үйлчилгээ, баарны үйлчилгээ / - /, Тусгай захиалгат хоолоор үйлчлэх үйлчилгээ, Машин тоног төхөөрөмжийн түрээсийн үйл ажиллагаа, ",1,"Нацаг.Тамир, ",Нацаг.Тамир,2013.10.31,"Нацаг.Тамир, ",2021-04-01
3564452,Өв арвайн ундарга,"Өвөрхангай, Арвайхээр, 5-р баг, Арвайхээр, 15, 20",2018.02.05,"Хүнсний дэлгүүрийн худалдаа, Дохиолол харуул хамгаалалтын үйлчилгээ, Дохиолол, холбооны эд анги хэрэгслийн худалдаа, засвар үйлчилгээ, ",1,"Алтангэрэл.Бямбасүрэн, ",Алтангэрэл.Бямбасүрэн,2018.02.05,,
3513076,Завханмандал нутгийн хөгжлийн төлөө сан,"Завхан, Завханмандал, 4-р баг, Нуга, нугын 2, 6 тоот",2022.10.21,"Сум орон нутгийн хөгжил дэвшилд болон бүтээн байгуулалтад дэмжлэг хувь нэмэр оруулах, ахмад, залуучуудыг болог тэднийг хөдөлмөр эрхлүүлэх идэвхитэй оролцуулах, сум орон нутагтаа гадаад болон дотоод хөрөнгө оруулалт татах, сум орон нутгийн ойг зохион байгуулах, хувь нэмэр оруулах, ",6,"Гаябазар.Мягмаржав, Гомборагчаа.Дамдиндорж, Гомборагчаа.Дамдинжав, Баатархүү.Бүдбал, Равдан.Даваажанцан, Нараа.Бямбадорж, ",Гомборагчаа.Дамдинжав,2022.10.21,"Гомборагчаа.Дамдинжав, ",2022-10-21
6461662,Мандах оройн товгор,"Улаанбаатар, Сонгинохайрхан, 31-р хороо, алтай 1, 37 тоот",2019.08.16,"Төмрөөр хашаа, хайс, хаалга, хаалт хийх, худалдаа, Тавилгын худалдаа, Тавилгын үйлдвэрлэл, Цэцэрлэгжүүлэлт, ",1,"Сэнгэравдан.Мягмардорж, ",Сэнгэравдан.Мягмардорж,2019.08.16,,
5093171,Блюскай эйжиа,"Улаанбаатар, Сүхбаатар, 1-р хороо, энхтайвны өргөн чөлөө, блю скай тауэр 3-р давхар",2006.10.31,"Гадаад худалдаа, Зочид буудал, рестораны үйл ажиллагаа / - /, ",2,".Э Лайн Проперти, Корпораци.Элдорадо Лайн, ",Chowdhury.Zahid,2023.05.03,"..Kim Jin Kyun, ..Kim Jin Kyun, ",2020-12-31
Тохирох мэдээлэл олдсонгүй,,,,,,,,,,
5520711,Грийн энержи интернэйшнл,"Улаанбаатар, Сүхбаатар, 4-р хороо, 24а, 16",2011.10.10,"Гадаад худалдаа, Эрчим хүчний зөвлөх үйлчилгээ, ",1,"Магнайбаяр.Тэмүүлэн, ",Магнайбаяр.Тэмүүлэн,2016.08.09,"Магнайбаяр.Тэмүүлэн, ",2020-12-30
3615294,Эрдэнийнгурван мөнх,"Өмнөговь, Манлай, , 0",2010.05.31,"Төлбөр эсвэл гэрээний үндсэн дээр хийгдэх бөөний худалдаа, Барааны дэлгүүр, Авто машинаар ачаа тээвэрлэх, Газар тариалан, Фермерийн аж ахуй, Цайны газар, ",1,"Шагдарсүрэн.Ариунаа, ",Шагдарсүрэн.Ариунаа,2022.06.28,"Шагдарсүрэн.Ариунаа, ",2022-06-28
5511194,Мөнхчандмань илч,"Улаанбаатар, Хан-Уул, 3-р хороо, 19 хороолол, 20, 29 тоот",2011.09.07,"Барилгын засвар, засал чимэглэл, ",1,"Цэвэгмид.Баярмагнай, ",Цэвэгмид.Баярмагнай,2013.11.25,"Цэвэгмид.Баярмагнай, ",2020-10-10
3012247,Сонор сүрэг,"Архангай, Их Тамир, 2-р баг, Хан-Өндөр, ",2019.04.17,"Малын эмийн сан, Мал эмнэлгийн үйл ажиллагаа, ",1,"Батхолбоо.Мэндбаяр, ",Батхолбоо.Мэндбаяр,2019.04.17,"Батхолбоо.Мэндбаяр, ",2020-10-27
5385539,Гүн-Анир,"Улаанбаатар, Баянгол, 6-р хороо, 12 тоот",2010.06.10,"Нарийн боовны тоног төхөөрөмжийн худалдаа, Цайны газрын үйлчилгээ / - /, Гадаад худалдаа, Талх, нарийн боовны үйлдвэрлэл, ",1,"Загд.Цэцэгмаа, ",Загд.Цэцэгмаа,2010.06.10,,
6413137,Бульдорс мон,"Улаанбаатар, Сүхбаатар, 11-р хороо, алтай 25, 132 тоот",2019.03.28,"Гадаад худалдаа, Газар тариалан, ",1,"Дугарсүрэн.Атарбаясгалан, ",Дугарсүрэн.Атарбаясгалан,2019.03.28,"Дугарсүрэн.Атарбаясгалан, ",2020-12-24
Тохирох мэдээлэл олдсонгүй,,,,"Буудай болон бараа бүтээгдэхүүн хадгалан,борлуулах,газар тариалан,гурил,тэжээлийн үйлдвэрлэл,гахай шувууны аж ахуй, ",,,Ваня.Үнэнбат,2016.09.29,,
3073394,Нур астана,"Баян-Өлгий, Өлгий, 5-р баг, Ховд гол, Астана дэлгүүрийн байр",2016.11.04,"Хүнсний бүтээгдэхүүний жижиглэн худалдаа, ",1,"Ануар.Берикхулан, ",Ануар.Берикхулан,2016.11.04,"Ануар.Берикхулан, ",2020-12-21
2875101,Дэмд-Од,"Өмнөговь, Сэврэй, 1-р баг, Сайншанд, 0",2006.08.07,"Дулаан цахилгаан үйлдвэрлэх түгээх /2005.01.25 - /, Цахилгаан тоног төхөөрөмж засвар үйлчилгээ, ",1,"Лувсанцэрэн.Энхтөр, ",Базага.Цогнэмэх,2016.03.29,,
4614437,Тулгат шинэ өрх,"Говьсүмбэр, Сүмбэр, 3-р баг, 15, 51 тоот",2015.09.30,"Гадаад худалдаа, Нийтийн хоолны үйлчилгээ, ",1,"Цэен.Оюунбилэг, ",Цэен.Оюунбилэг,2015.09.30,"Цэен.Оюунбилэг, ",2020-10-09
6862918,Хүүхдийн хөгжлийн сэтгэл ундрах хүрээлэн,"Улаанбаатар, Баянзүрх, 6-р хороо, 13 хороолол, 48, 5 тоот",2022.05.03,"Сэтгэл зүйн чиглэлээр зөвлөгөө өгөх, сургалт явуулах, судалгаа хийх, ",5,"Пүрэвдорж.Марал, Лхамсүрэн.Пүрэвдорж, Болдбаатар.Ичинхорлоо, Агваанбаяр.Баярхүү, Мижгээ.Хишигундрах, ",Мижгээ.Хишигундрах,2022.05.03,"Мижгээ.Хишигундрах, ",2022-05-03
2774607,Ууганцагаан,"Улаанбаатар, Сонгинохайрхан, 21-р хороо, 2 хэсэг өндөрхаан 3 гудамж 4 тоот",2006.04.17,"Халуун усны үйлчилгээ, Сүү, сүүн бүтээгдэхүүний худалдаа, Хүнсний дэлгүүр, Үсчин, гоо сайхны үйлчилгээ, Төсөл, хөтөлбөр хэрэгжүүлэх, Сүү, сүүн бүтээгдэхүүний үйлдвэрлэл, Цайны газар, Барьцаалан зээлдүүлэх үйлчилгээ, ",1,"Ширбазар.Батпүрэв, ",Ширбазар.Батпүрэв,2006.04.17,"Ширбазар.Батпүрэв, ",2020-10-17
6753884,Аюур мед дэвшил,"Улаанбаатар, Баянгол, 15-р хороо, 3-р хороолол, энэбишийн гудамж, 29, 40 тоот",2021.09.09,"Эм, эмнэлгийн хэрэгсэл, биологийн идэвхт бүтээгдэхүүн импортлох, хангах нийлүүлэх /2022.06.08 - 2027.06.08/, Гоо сайхан ариун цэврийн барааны худалдаа, Онлайн худалдаа, Төлбөр эсвэл гэрээний үндсэн дээр хийгдэх бөөний худалдаа, Спортын багаж төхөөрөмжийн төрөлжсөн худалдаа, Спортын клубын үйл ажиллагаа, ",3,"Орхонтуул.Амгаланхүү, Баасанжав.Хангал, Шинэбаяр.Идэрсайхан, ",Орхонтуул.Амгаланхүү,2021.09.09,"Шинэбаяр.Идэрсайхан, Орхонтуул.Амгаланхүү, ",2022-12-21
5432928,Пандамүвинг,"Улаанбаатар, Баянзүрх, 7-р хороо, 42",2010.12.14,"Автомашинаар  ачаа тээвэрлэх үйлчилгээ, Гадаад худалдаа, ",1,"Гансүх.Энхбаяр, ",Гансүх.Энхбаяр,2010.12.14,"Гансүх.Энхбаяр, ",2020-10-16
6586104,НЭГМ электроникс,"Улаанбаатар, Баянзүрх, 13-р хороо, энхтайваны өргөн чөлөө, 116, 35 тоот",2020.06.17,"Онлайн худалдаа, Автомашины сэлбэг, эд ангийн худалдаа, Хяналтын камер суурилуулах, Хяналтын камерийн худалдаа, Компьютер, түүний дагалдах хэрэгсэлийн худалдаа, Худалдааны зуучлал, ",1,"Ганбат.Ганжаргал, ",Ганбат.Ганжаргал,2020.06.17,"Ганбат.Ганжаргал, ",2020-06-17
5798841,Смарт прожект,"Улаанбаатар, Баянгол, 17-р хороо, 4 хороолол, жалханц хутагт дамдинбазар, 44д, 25 тоот",2014.02.12,"Халуун усны үйлчилгээ, Хүнд машин механизмийн түрээсийн үйлчилгээ, Барилгын материалын худалдаа, Хүнсний дэлгүүр, Барилгын засвар, засал чимэглэл, Гадаад худалдаа, ",1,"Сэдрагчаа.Лхагвасүрэн, ",Сэдрагчаа.Лхагвасүрэн,2014.02.12,"Сэдрагчаа.Лхагвасүрэн, ",2020-10-09
5997321,Анрид,"Улаанбаатар, Чингэлтэй, 5-р хороо, 22, 2 тоот",2015.08.27,"Бизнесийн зөвлөгөө өгөх, Зар сурталчилгаа явуулах, Вэб сайт ажиллуулах, ",2,".Тэнгэрлиг Медиа Групп, Амарсайхан.Ундрал, ",Долингор.Ганзориг,2022.01.30,"Амарсайхан.Ундрал, ",2023-03-07
6152341,Чорж гэгээн,"Улаанбаатар, Баянзүрх, 19-р хороо, цайз 41а, 770 тоот",2017.02.14,"Автомашинаар ачаа тээвэрлэх, Халуун усны үйлчилгээ, Хүнс, барааны дэлгүүр, Автомашины угаалга, Барьцаалан зээлдүүлэх үйлчилгээ, ",1,"Ганбаатар.Цэгмэд, ",Ганбаатар.Цэгмэд,2017.02.14,,
3125955,Дуурсах-Агро,"Баянхонгор, Баянхонгор, 7-р баг, Цахир, 0",2011.12.16,"Мод модон эд анги үйлдвэрлэл, Малын тэжээлийн үйлдвэрлэл, Оёдол үйлдвэрлэл, Хуурай замаар хийгдэх ачаа тээвэр, Хүнсний ногоо, үрслэг тариалалт, Дотоод болон гадаад худалдаа, Жимс жимсгэнэ тариалалт, Хүнсний барааны жижиглэн худалдаа, Мах махан бүтээгдэхүүний худалдаа, Барилгыг дуусгах шатны ажил, Зээл олгох бусад үйлчилгээ, ",1,"Тамжаа.Баточир, ",Тамжаа.Баточир,2014.07.21,,
8263817,Гурван зөв,"Улаанбаатар, Сонгинохайрхан, 3-р хороо, бага наран 40, 17 тоот",2017.12.11,"Олон нийтийг нийгмийн сайн сайхны төлөө үйлст дэмжих, боловсрол, соёлын чиглэлээр сургалт зохион байгуулах, төсөл, хөтөлбөр боловсруулах, ижил зорилготой байгууллагуудтай хамтран ажиллах, ",3,"Найрамдал.Пүрэвсүрэн, Дамба.Отгонсүрэн, Баттогтох.Солонго, ",Найрамдал.Пүрэвсүрэн,2018.04.24,"Найрамдал.Пүрэвсүрэн, ",2020-10-14
2034751,Газаршороо,"Хөвсгөл, Эрдэнэбулган, 3-р баг, Зэрлэг, 0",2005.10.27,"Гахайн аж ахуйн үйл ажиллагаа, Тослог жимс тариалалт, Үр тарианы гурил үйлдвэрлэл, Үр тариа болон бусад ургамал тариалалт, Yхрийн аж, ахуй эрхлэх үйл ажиллагаа, ",1,"Цэдэв.Хургаа, ",Цэдэв.Хургаа,2005.10.27,"Цэдэв.Хургаа, ",2020-12-01
5549388,Наран-Ургац,"Улаанбаатар, Сүхбаатар, 10-р хороо, 18",2012.01.10,"Барилгын засвар, засал чимэглэл, Газар тариалан эрхлэх, Гадаад худалдаа, ",2,"Лхагваочир.Баясгалан, Агваандугар.Болормаа, ",Наранчимэг.Гантулга,2012.01.10,,
6955622,Иллюшион,"Улаанбаатар, Баянзүрх, 43-р хороо, 13 хороолол, 152, 67 тоот",2022.11.22,"Барьцаалан зээлдүүлэх үйлчилгээ, Төсөл хөтөлбөр хэрэгжүүлэх, Соёл урлагын арга хэмжээ зохион байгуулах, Цайны газар, Дуу дүрс бичлэг хийх, Хүнсний дэлгүүр, Төлбөр эсвэл гэрээний үндсэн дээр хийгдэх бөөний худалдаа, Барилгын материалын худалдаа, Барилгын засвар хийх, ",2,"Болдбаатар.Түмэндэлгэр, Төмөр.Галмандах, ",Төмөр.Галмандах,2022.11.22,"Болдбаатар.Түмэндэлгэр, Төмөр.Галмандах, ",2022-11-22
6678785,Дөрөвдүгээр эмнэлэг,"Улаанбаатар, Баянзүрх, 18-р хороо, 13 хороолол, манлай баатар дамдинсүрэн, 25 тоот",2021.03.16,"Төсөл хөтөлбөр хэрэгжүүлэх, ",4,".Олон Амжилт, Болорэрдэнэ.Уянга, Банзрагч.Баяржаргал, .Скайпрофешнл Медтек, ",Банзрагч.Золжаргал,2021.03.16,"Банзрагч.Золжаргал, Банзрагч.Баяржаргал, ",2021-09-29
5593794,Иххаргуйн зам,"Улаанбаатар, Хан-Уул, 11-р хороо, 6 тоот",2012.04.26,"Хүнд машин механизмийн түрээсийн үйлчилгээ, Авто зам, замын байгууламжийг барих, засварлах: 3.7.1.1.4 3Б-1-4/15 км хүртэл / хатуу хучилттай зам барих / 2014.03.28-2017.03.28 / /2014.03.28 - 2017.03.28/, Гадаад худалдаа, ",1,"Янжив.Жамбажанцан, ",Янжив.Жамбажанцан,2012.04.26,"Янжив.Жамбажанцан, ",2021-04-14
6318703,Сүндэр дуурсгах,"Улаанбаатар, Хан-Уул, 15-р хороо, рапид харш, 1, 135 тоот",2018.06.12,"Барилгын засвар хийх, Мах, махан бүтээгдэхүүний үйлдвэрлэл, худалдаа, Авто машинаар ачаа тээвэрлэх, Гадаад худалдаа, Хүнсний дэлгүүр, ",1,"Лхагваа.Түвшинтөгс, ",Лхагваа.Түвшинтөгс,2018.06.12,"Лхагваа.Түвшинтөгс, ",2021-06-23
5088712,Говьхангай мебель,"Улаанбаатар, Сүхбаатар, 8-р хороо, 11 хороолол, 2, 52",2006.10.10,"Тавилгын үйлдвэрлэл, худалдаа, Гадаад худалдаа, ",2,"Цэвээнжав.Баянмөнх, Цэвээнжав.Мөнхбат, ",Цэвээнжав.Баянмөнх,2012.08.17,,
Тохирох мэдээлэл олдсонгүй,,,,,,,,,,
5650674,Алтанбэрс интернэшнл,"Улаанбаатар, Хан-Уул, 3-р хороо, чингисийн өргөн чөлөө, УБ хивс байр, 402 тоот",2012.11.16,"0.4-35 кв-ын цахилгаан дамжуулах шугам, дэд станцын засвар, угсралт, түүний туршилт тохируулга, дагалдах ажил үйлчилгээ /2021.06.30 - 2026.06.30/, Авто машины худалдаа, Авто машины сэлбэг, эд ангийн худалдаа, Төлбөр эсвэл гэрээний үндсэн дээр хийгдэх бөөний худалдаа, Дохиолол, хяналтын камер суурилуулах, Авто машинаар ачаа тээвэрлэх, Менежментийн зөвлөгөө өгөх, Барилгын материалын худалдаа, Барилга угсралт /БА-2.1, БА-6.1, БА-6.3, БА-7.1 заалтын дагуу/ /2022.10.18 - 2027.10.18/, ",2,"Баасанхүү.Цогточир, Баасанхүү.Цогтгэрэл, ",Баасанхүү.Цогтгэрэл,2022.12.12,"Баасанхүү.Цогточир, Баасанхүү.Цогтгэрэл, ",2022-12-12
4091949,Авид дэвшил,"Ховд, Жаргалант, 6-р баг, Жаргалан, 1/80, 38",2021.06.11,"Түргэн хоолны газрын үйлчилгээ, Хүнсний төрөлжсөн дэлгүүрийн жижиглэн худалдаа, Ундаагаар үйлчлэх үйл ажиллагаа, Гэр ахуйн барааны бөөний худалдаа, Гэр ахуйн бусад барааны төрөлжсөн дэлгүүрийн жижиглэн худалдаа, Кафе, гуанз, зоогийн газрын үйлчилгээ, Рестораны үйлчилгээ, Хүнсний бөөний худалдаа, Хуурай замаар хийгдэх ачаа тээвэр, ",1,"Мөнхтүвшин.Төрхүү, ",Цогточир.Ариунзаяа,2021.08.04,"Мөнхтүвшин.Төрхүү, ",2021-06-11
2555913,ЭХБУТрест,"Улаанбаатар, Хан-Уул, 3-р хороо, ажилчны, ЭХБУТрест компанийн өөрийн байр",2009.02.19,"Төмөр бетон эдлэл үйлдвэрлэл, даацын хийц эдлэлийн үйлдвэрлэл /БМҮ 075/17 2017.08.11-2022.08.11/, Химийн хортой, аюултай бодис импортлох ашиглах / 0001337 2019.04.16-2022.04.16 /, Төлбөр эсвэл гэрээний үндсэн дээр хийгдэх бөөний худалдаа, ",5,"Содномдорж.Жаргалсайхан, Самбуу.Сүхтөмөр, Агваандорж.Цэлмэг, Дашжамц.Баттулга, Лувсандаш.Дашдорж, ",Дашжамц.Баттулга,2021.12.03,"Содномдорж.Жаргалсайхан, Дашжамц.Баттулга, ",2021-12-03
9039481,Завхан аймгийн ахмадын хороо,"Завхан, Улиастай, 1-р баг, Жинст, баатар зээлийн хэсэг 3, Өөрийн байранд",2015.06.15,"Ахмадын эрх ашгийг хамгаалах, ",1,"Долгор.Дэчинсамбуу, ",Товуу.Пүрэвжаргал,2018.03.14,"Үлэмж.Юнрэн, Товуу.Пүрэвжаргал, Сүрэнхүү.Нямсүрэн, Өлзийочир.Мангалбазар, Балжинням.Ганболд, ",2020-12-22
3136574,Монос баянхонгор,"Баянхонгор, Баянхонгор, 3-р баг, Дуурсах, Нэгдсэн эмнэлгийн хашаа  Моносфарм трейд ХХК байр",2018.12.12,"Эм, гоо сайхан, ариун цэврийн барааны жижиглэн худалдаа, Эм, эмнэлгийн хэрэгсэл ханган нийлүүлэх, ",1,"Лувсан.Хүрэлбаатар, ",Хүрэлбаатар.Ананд,2022.03.18,"Лувсан.Хүрэлбаатар, Лувсан.Хүрэлбаатар, ",2020-10-13
2771667,Номунсэлэнгэ,"Сэлэнгэ, Сүхбаатар, 2-р баг, Цагаан-Эрэг, 2-р хэсэг, 1 тоот",2005.10.05,"Гадаад дотоод худалдаа, ",1,"Цэвээндорж.Алтанцэцэг, ",Цэвээндорж.Алтанцэцэг,2021.10.15,"Цэвээндорж.Алтанцэцэг, ",2021-10-15
3129233,Баялаг алтан ганьдирс,"Баянхонгор, Бөмбөгөр, 4-р баг, Задгай, ",2013.09.30,"Төрөлжсөн бус барааны бусад  дэлгүүрийн  жижиглэн худалдаа, Хоёрдогч түүхий эд боловсруулах, Барилгыг дуусгах шатны ажил, Газар тариалан, мал амьтны ашиг шимийг авах үйл ажиллагааг хослон эрхэлдэг аж ахуйн үйл ажиллагаа, Хэвлэлийн эх бэлтгэх, Төлбөр эсвэл гэрээний үндсэн дээр хийгдэх бөөний худалдаа, Бичиг хэрэгслийн худалдаа, Богино хугацаагаар байр, сууцаар хангах үйл ажиллагаа, Кафе, зоогийн газрын үйлчилгээ, ",1,"Пүрэв.Баянбаатар, ",Пүрэв.Баянбаатар,2013.09.30,"Пүрэв.Баянбаатар, ",2020-12-24
