Регистр,Нэр,Хаяг,Бүртгэсэн_огноо,Үйл_ажиллагааны_чиглэл,Хувьцаа_эзэмшигчийн_тоо,Хувьцаа_эзэмшигч_гишүүд,Итгэмжлэлгүйгээр_төлөөлөх_албан_тушаалтан,ИТАТ_бүртгэсэн_огноо,Эцсийн_Өмчлөгч,ЭӨ_бүртгэсэн_огноо
2809575,Эрүүлмэнд интернэшнл,"Улаанбаатар, Сүхбаатар, 1-р хороо, энхтайвны өргөн чөлөө, UBH center 6 давхар 611 тоот",2006.09.25,"Гоо сайхны бүтээгдэхүүн үйлдвэрлэл, Ундаа усны үйлдвэрлэл, Мах, махан бүтээгдэхүүний худалдаа, Мах, махан бүтээгдэхүүн үйлдвэрлэл, Сонин, сэтгүүлийн болон тогтмол хэвлэлийн эх бэлтгэх, нийтлэх үйл ажиллагаа, Жимс, жимсгэний мод тариалах, Аялал, жуулчлал, Барилгын материалын худалдаа, Талх нарийн боовны худалдаа, Сэргээгдэх эрчим хүчний тоног төхөөрөмжийн засвар үйлчилгээ, Сэргээгдэх эрчим хүчний тоног төхөөрөмжийн худалдаа, Газар тариалан, Бэлэн хувцасны худалдаа, Гурил, гурилан бүтээгдэхүүний үйлдвэрлэл, Сэргээгдэх эрчим хүчний чиглэлээр зөвөлгөө өгөх, Биологийн идэвхт бүтээгдэхүүн импортлох ханган нийлүүлэх /2016.01.15-2024.01.15/, Гурил, гурилан бүтээгдэхүүний худалдаа, Төлбөр эсвэл гэрээний үндсэн дээр хийгдэх бөөний худалдаа, Барилгын засвар хийх, Сүү сүүн бүтээгдэхүүн худалдаа, Бичиг хэргийн бөөний болон жижиглэн худалдаа, Талх, нарийн боов үйлдвэрлэл, Төсөл хөтөлбөр хэрэгжүүлэх, Гоо сайхны бүтээгдэхүүний худалдаа, Ундаа усны худалдаа, Сүүн бүтээгдэхүүн үйлдвэрлэл, ",2,"Усника.Болормаа, Усника.Мөнхзул, ",Усника.Мөнхзул,2022.10.17,"Усника.Мөнхзул, Усника.Болормаа, ",2022-10-17
5107334,Намуунтамир,"Улаанбаатар, Сонгинохайрхан, 17-р хороо, 218 тоот",2007.01.04,"Эм барих, эм найруулах /2007.02.10 - /, Гадаад худалдаа, Газар тариалан, ",1,"Пагжийбуу.Чулуунтогтох, ",Пагжийбуу.Чулуунтогтох,2007.01.04,"Пагжийбуу.Чулуунтогтох, ",2020-12-08
5065437,Ньюсеметри,"Улаанбаатар, Сүхбаатар, 1-р хороо, автозамчдын, Улаанбаатар буян ХХК-ийн байр ",2006.05.29,"Гадаад худалдаа, Буяны үйлчилгээ, Оршуулгын үйлчилгээ, ",5,"Мэндбаяр.Золзаяа, Мэндбаяр.Мөнхзаяа, Мэндбаяр.Учралзаяа, Гаравсүрэн.Идэрмаа, Орсоо.Мэндбаяр, ",Мэндбаяр.Мөнхзаяа,2016.11.04,"Мэндбаяр.Мөнхзаяа, ",2020-09-28
5530733,Нанобридж,"Улаанбаатар, Хан-Уул, 15-р хороо, 19 тоот",2011.11.09,"Компьютер болон түүний сэлбэг хэрэгслийн худалдаа, ",1,"Монхоодой.Отгонтуяа, ",Монхоодой.Отгонтуяа,2011.11.09,"Монхоодой.Отгонтуяа, ",2020-10-10
6133827,Мөнх дөлгөөн хэрлэн,"Улаанбаатар, Сүхбаатар, 14-р хороо, хандгайтын 38, 455 тоот",2016.12.23,"Төмрөөр хашаа, хайс, хаалга хийх, Цайны газар / - /, ",1,"Чойжил.Одмаа, ",Чойжил.Одмаа,2016.12.23,"Чойжил.Одмаа, ",2022-05-30
6077048,Гэрэлтэх бүртгэл аудит,"Улаанбаатар, Баянгол, 4-р хороо, 2 хороолол, энх тайвны өргөн чөлөө, 12, 12 тоот",2016.05.16,"Аудитын үйл ажиллагаа /хугацаа 2017.01.13-2020.01.13/ /2017.01.13 - 2020.01.13/, ",1,"Аюурсэд.Сарангэрэл, ",Аюурсэд.Сарангэрэл,2016.05.16,"Аюурсэд.Сарангэрэл, ",2020-08-15
5759641,Супертун,"Улаанбаатар, Баянзүрх, 26-р хороо, 200, 01 тоот",2013.10.17,"Гадаад худалдаа, Эм барих /2016.12.31-2019.12.31/ /2016.12.31 - 2019.12.31/, ",1,"Эрдэнэочир.Болормаа, ",Эрдэнэочир.Болормаа,2013.10.17,"Эрдэнэочир.Болормаа, ",2020-10-17
3553418,Ууган-Ундрам,"Өвөрхангай, Баян-Өндөр, 5-р баг, Бумбат, 2",2009.09.15,"Арьс, шир, түүхий эдийн худалдаа, Цахилгаан бараа худалдаа, Мах, махан бүтээгдэхүүний худалдаа, Барилгын материалын худалдаа, Хүнс, барааны төрөлжсөн худалдаа, Сүү, сүүн бүтээгдэхүүний худалдаа, Тавилга үйлдвэрлэл, худалдаа, Газар тариалан худалдаа, Автомашин, мотоцикл сэлбэгийн худалдаа, ",1,"Догообанди.Батмөнх, ",Догообанди.Батмөнх,2009.09.15,"Догообанди.Батмөнх, ",2023-05-05
2137704,Брайвусүм,"Дорноговь, Сайншанд, 4-р баг, 0",2005.09.13,"Эм ханган нийлүүлэх тусгай зөвшөөрөлтэй. 2011.11.10  өдөр хүртэл, Эм, гоо сайхны барааны жижиглэн худалдаа / - /, ",2,"Дүгэрсүрэн.Тунгалагтамир, Намсрай.Алтангэрэл, ",Намсрай.Алтангэрэл,2005.09.13,"Дүгэрсүрэн.Тунгалагтамир, Намсрай.Алтангэрэл, ",2020-10-01
6989969,Фүүл кост,"Улаанбаатар, Баянгол, 25-р хороо, го-парк, 103, 210 тоот",2023.02.03,"Барилгын засвар хийх, Барилгын материалын худалдаа, Төлбөр эсвэл гэрээний үндсэн дээр хийгдэх бөөний худалдаа, Хэвлэлийн эх бэлтгэл, ",1,"Вандансанги.Баярзориг, ",Вандансанги.Баярзориг,2023.02.03,"Вандансанги.Баярзориг, ",2023-02-03
6990053,Бүрэн фонд,"Улаанбаатар, Баянгол, 25-р хороо, го-парк, 103, 210 тоот",2023.02.03,"Бизнесийн зөвлөгөө өгөх, Санхүүгийн тайлан баланс гаргах түүнтэй холбоотой зөвлөгөө өгөх, Төлбөр эсвэл гэрээний үндсэн дээр хийгдэх бөөний худалдаа, Хэвлэлийн эх бэлтгэл, ",1,"Энхамгалан.Цэцэгмаа, ",Энхамгалан.Цэцэгмаа,2023.02.03,"Энхамгалан.Цэцэгмаа, ",2023-02-03
6995357,Үлэмж эффектив дата,"Улаанбаатар, Баянгол, 25-р хороо, энхтайваны өргөн чөлөө, го-парк, 103, 210 тоот",2023.02.15,"Зар сурталчилгаа хийх, Сонин, сэтгүүл болон тогтмол хэвлэлийн эх бэлтгэл, Вэб сайтын үйлчилгээ, ",1,"Энхамгалан.Цэцэгмаа, ",Энхамгалан.Цэцэгмаа,2023.02.15,"Энхамгалан.Цэцэгмаа, ",2023-02-15
4248171,"Дархан хот байгуулалт, барилга захиалагчийн газар","Дархан-Уул, Дархан, 13-р баг, 32 тоот",2007.02.09,"Барилгын техникийн хяналт тавих, ",1,".Дархан Хот Байгуулалт, Барилга Захиалагчийн Газар, ",Даваасамбуу.Батбаяр,2020.12.18,"Чойжил.Батбулган, ",2020-10-08
6651615,Сэлэм ньюс,"Улаанбаатар, Хан-Уул, 19-р хороо, 32, 1 тоот",2021.01.15,"Программ хангамжийн үйл ажиллагаа, Уран сайхны болон баримтат кино хийх, Хэвлэлийн эх бэлтгэх хийх, Вэб сайтын үйлчилгээ, Мэдээлэл технологийн үйл ажиллагаа, Дуу, дүрс бичлэг хийх, Сонин, сэтгүүлийн болон тогтмол хэвлэлийн эх бэлтгэх, нийтлэх үйл ажиллагаа, ",2,"Мижиддорж.Нандинцэцэг, Нацагдорж.Мөнхбаяр, ",Мөнхтулга.Мижид,2022.02.09,"Мижиддорж.Нандинцэцэг, ",2022-06-13
5839505,Номадсрэзидэнс,"Улаанбаатар, Сүхбаатар, 8-р хороо, 2-р байр",2014.05.06,"Зочид буудал, Үзэсгэлэн яармаг зохион байгуулах, Төлбөр эсвэл гэрээний үндсэн дээр хийгдэх бөөний худалдаа, Аялал жуулчлал, ",1,"Мягмар.Есөнмөнх, ",Дашзэвэг.Дэжид,2017.11.08,"Мягмар.Есөнмөнх, ",2022-12-30
6731031,Бю Са Ми,"Улаанбаатар, Чингэлтэй, 1-р хороо, Матрикс төв 301 тоот",2021.07.21,"Төлбөр эсвэл гэрээний үндсэн дээр хийгдэх бөөний худалдаа, Барилгын засвар хийх, Газар тариалан, Гоо сайхан, ариун цэврийн барааны худалдаа, Барилгын материалын худалдаа, Бичиг хэрэгслийн худалдаа, ",1,"Дамдинсүрэн.Батэрдэнэ, ",Дамдинсүрэн.Батэрдэнэ,2021.07.21,"Дамдинсүрэн.Батэрдэнэ, ",2021-07-21
5359171,Энх-Арслан,"Улаанбаатар, Баянгол, 2-р хороо, Hill Side 2-1 тоот",2010.02.24,"Вэб сайт хийх, Үндэсний хувцасны үйлдвэрлэл, худалдаа, Гадаад худалдаа, Бизнесийн зөвлөгөө өгөх, Цайны газар / - /, Хүнсний дэлгүүр, ",1,"Чулуунбат.Энхтамир, ",Чулуунбат.Энхтамир,2010.02.24,"Чулуунбат.Энхтамир, ",2020-12-30
2412918,Баялаг үйл ундрах,"Хөвсгөл, Цэцэрлэг, 5-р баг, Халбан, ,",2005.11.17,"Мал эмнэлгийн үйл ажиллагаа, ",1,"Мижиддорж.Баатаржав, ",Мижиддорж.Баатаржав,2021.05.20,"Мижиддорж.Баатаржав, ",2020-10-20
6391931,Өсөн үржих констракшн ,"Улаанбаатар, Баянгол, 7-р хороо, 3 хороолол /16092/, 29, 64",2019.01.25,"Гадаад  худалдаа, Барилгын засвар хийх, Аялал  жуулчлал, ",1,"Арсланбаатар.Эрдэнэхүү, ",Арсланбаатар.Эрдэнэхүү,2019.06.05,"Цэндсүрэн.Нямсүрэн, ",2020-10-10
3554775,Өвтүвшин хангай,"Өвөрхангай, Арвайхээр, 5-р баг, Арвайхээр, 37 тоот",2011.04.18,"Модон материалын худалдаа / - /, ",1,"Гомбо.Нэргүй, ",Гомбо.Нэргүй,2011.04.18,"Гомбо.Нэргүй, ",2020-11-04
3061353,Баянцамбагарав,"Баян-Өлгий, Өлгий, 5-р баг, Ховд гол, 0",2005.12.13,"Бөөний худалдааны бусад / - /, ",1,"Хахтан.Саясат, ",Хахтан.Саясат,2005.12.13,"Хахтан.Саясат, ",2022-10-12
6840884,Вондер Би Эл Би,"Улаанбаатар, Хан-Уул, 20-р хороо, 94в, 96 тоот",2022.03.22,"Гэрийн худалдаа, Хүнсний ногоо тариалах худалдаа, Онлайн худалдаа, Төлбөр эсвэл гэрээний үндсэн дээр хийгдэх бөөний худалдаа, ",1,"Дагвадорж.Баяржаргал, ",Дагвадорж.Баяржаргал,2022.03.22,"Дагвадорж.Баяржаргал, ",2022-03-22
5941717,БТОЗ,"Улаанбаатар, Сүхбаатар, 8-р хороо, бага тойруу, 43, 19 тоот",2015.03.18,"Зар сурталчилгаа хийх, Сав баглаа боодлын үйлчилгээ, Төлбөр эсвэл гэрээний үндсэн дээр хийгдэх бөөний худалдаа, Бэлэг дурсгалын үйлчилгээ, Гэрэл зургийн үйлчилгээ, ",3,"Цэвээн.Баянмөнх, Баянмөнх.Золжаргал, Баянмөнх.Одонтунгалаг, ",Баянмөнх.Золжаргал,2023.05.16,"., Баянмөнх.Золжаргал, ",2023-05-16
6369863,Эрдэнэс үндэсний судалгаа хөгжлийн төв,"Улаанбаатар, Хан-Уул, 1-р хороо, 120 мянгат, 17 байр 9 тоот",2018.11.17,"Гадаад худалдаа, Техник технологийн судалгаа, ",1,"Ганаа.Баттөгс, ",Бавуу.Чинзориг,2020.02.14,"Ганаа.Баттөгс, ",2020-01-16
2078724,Дүүхээ,"Улаанбаатар, Баянгол, 8-р хороо, 0",2006.12.20,"Гадаад худалдаа, Хүнс,барааны дэлгүүр, Хүнсний бөөний худалдаа / - /, Баар / - /, Цэвэр усны үйлдвэр, ",1,"Пүрэв.Балдорж, ",Балдорж.Лхагвасүрэн,2022.01.10,"Пүрэв.Балдорж, ",2020-12-29
2044072,Цэрэн-Интернэшнл,"Улаанбаатар, Хан-Уул, 3-р хороо, үйлдвэрийн гудамж 67 /17060/ Комфорт плаза 122 тоот",2006.02.24,"Барилгын засвар, засал чимэглэл, Гадаад худалдаа, Барааны дэлгүүр, Цайны газар, Фитнес иог, Онлайн худалдаа, Барилгын материалын худалдаа, Ноос, ноолуур боловсруулах, Зочид буудал, ",1,"Түдэв.Цэрэнпүрэв, ",Түдэв.Цэрэнпүрэв,2021.10.07,"Түдэв.Цэрэнпүрэв, Түдэв.Цэрэнпүрэв, ",2020-12-30
5431301,Төгөлдөр-Ананд,"Өмнөговь, Даланзадгад, 6-р баг, Их уул, баянбулаг, 36, 1",2010.12.07,"Барилгын засвар, засал чимэглэл, Гадаад худалдаа, Сүү, сүүн бүтээгдэхүүн үйлдвэрлэл, худалдаа, Газар тариалан эрхлэх, Аялал жуулчлал, ",1,"Алтангэрэл.Алтанбагана, ",Алтангэрэл.Алтанбагана,2010.12.07,"Алтангэрэл.Алтанбагана, ",2020-03-20
6386016,Чин хөрс,"Улаанбаатар, Сүхбаатар, 10-р хороо, 7 хороолол, 4б, 14 тоот",2019.01.10,"Гадаад худалдаа, Газар тариалан, Хүнсний бөөний  худалдаа, Төмс хүнсний ногоо тариалах, ",1,"Давааням.Отгонбаяр, ",Давааням.Отгонбаяр,2019.01.10,"Давааням.Отгонбаяр, ",2020-12-28
5131782,Их засаг олон улсын их сургууль,"Улаанбаатар, Баянзүрх, 4-р хороо, 00",2007.04.18,"Дээд боловсрол олгох үйл ажиллагаа /2012.06.21-2015.07.01/ /2003.12.01 - /, ",3,"Нямосор.Учрал, Намсрай.Нямосор, Нямосор.Ундрал, ",Намсрай.Нямосор,2007.04.18,"Намсрай.Нямосор, ",2020-08-21
3017664,Ембүүтэй нуур,"Архангай, Тариат, 2-р баг, Цагааннуур, 0",2023.01.18,"Хүнсний дэлгүүрийн жижиглэн худалдаа, Мах, махан бүтээгдэхүүн боловсруулах, Аялал жуулчлал үйл ажиллагаа, Сүүн бүтээгдэхүүн үйлдвэрлэл, Төмөр хийц, ",1,"Янсанжав.Алтансүх, ",Янсанжав.Алтансүх,2023.01.18,"Янсанжав.Алтансүх, ",2023-01-18
6550495,Энгүй агужим,"Улаанбаатар, Баянзүрх, 7-р хороо, 15 хороолол, 116, 50 тоот",2020.03.30,"Хувь хүнд боловсрол олоход нь туслан дэмжих зорилгоор тэдэнд сургалт семинар зохион байгуулах, төсөл хөтөлбөр хэрэгжүүлэх, ",3,"Энхтуяа.Энхтуул, Мижиддорж.Төгөлдөр, Бадам.Батхишиг, ",Энхтуяа.Энхтуул,2020.03.30,"Энхтуяа.Энхтуул, ",2020-03-30
5593026,Классикроуд,"Улаанбаатар, Чингэлтэй, 12-р хороо, 413 тоот",2012.04.24,"Гадаад худалдаа, Барилгын засвар засал чимэглэл, ",3,"Чулуунбат.Төгсбат, Пэрэнлэй.Насанхүү, Давааням.Нямдорж, ",Чулуунбат.Төгсбат,2012.04.24,,
6861164,Сэтгэл судлал таны амьдралд,"Улаанбаатар, Хан-Уул, 17-р хороо, богд жавзандамба, 54в, 8 тоот",2022.04.28,"Сэтгэл судлалын шинжлэх ухааныг иргэд, олон нийтэд сурталчлах, сэтгэл зүйн боловсрол, мэдлэг олгох зорилгоор сургалт, семинар зохион байгуулах, зөвлөгөө мэдээллээр хангах, төсөл хөтөлбөр хэрэгжүүлэх, ижил зорилготой байгууллагуудтай хамтран ажиллах, ",3,"Лхагважав.Сэлэнгэ, Батсүх.Биндэръяа, Шайрий.Батсүх, ",Шайрий.Батсүх,2022.04.28,"Шайрий.Батсүх, ",2022-04-28
5713501,Даваагийн өргөө,"Улаанбаатар, Баянгол, 21-р хороо, горькийн 19, 576 тоот",2013.05.22,"Гадаад худалдаа, Аялал жуулчлал, Барилгын засвар, засал чимэглэл, Барилгын материалын худалдаа, ",1,"Даваадагва.Даваасамбуу, ",Даваадагва.Даваасамбуу,2013.05.22,"Даваадагва.Даваасамбуу, ",2022-05-27
2620952,Донбэйс,"Булган, Дашинчилэн, , 4 тоот",2005.12.08,"Зоогийн газар, гуанз, цайны газрын үйлчилгээ / - /, Халуун ус, Гадаад дотоод худалдаа, Байгалийн хадлан бэлтгэл, Мал аж ахуй, Мал эмнэлгийн үйлчилгээ, Хүнс, ундаа, тамхины бөөний худалдаа, Зочид буудал, амралтын газар, түр хоноглох байрны үйлчилгээ, Газар тариалан, ",1,"Дондоо.Цагаанхүү, ",Дондоо.Цагаанхүү,2015.01.10,"Цагаанхүү.Амаржаргал, ",2020-12-30
3680517,Мөнх түвшин вит,"Сүхбаатар, Түвшинширээ, 4-р баг, Дэлгэрхаан, 8-3",2017.04.26,"Мал эмнэлгийн үйл ажиллагаа, Малын эмийн сангийн үйл ажиллагаа / - /, ",1,"Нацагдорж.Минжбадгар, ",Нацагдорж.Минжбадгар,2017.04.26,"Нацагдорж.Минжбадгар, ",2020-09-09
8137056,Улзын хөгжил,"Дорнод, Баян-Уул, 4-р баг, Хошуу, Хуучин цагдаагийн газрын байр 01 тоот",2014.04.24,"Төрийн үйлчилгээ эрхлэх, ",1,".Migration-Р Хоосон Ирсэн, ",Төмөрзүрх.Төмөрчулуун,2022.05.30,,
4260627,И Эс Би Ай,"Дархан-Уул, Дархан, 11-р баг, 2, 46",2012.03.05,"Барилгын материалын худалдаа, Гадаад дотоод худалдаа, Барилгыг дуусгах шатны ажил, ",1,"Батнасан.Халиунаа, ",Батнасан.Халиунаа,2021.01.15,"Батнасан.Халиунаа, ",2021-01-15
6962165,Инспайред инком,"Улаанбаатар, Баянгол, 17-р хороо, 4 хороолол, амарсанаа, 102, байр 36 тоот",2022.12.06,"Хэвлэлийн үйлдвэрлэл, ",1,"Батгэрэл.Тамир, ",Батгэрэл.Тамир,2022.12.06,"Батгэрэл.Тамир, ",2022-12-06
2780275,Үнэрч,"Улаанбаатар, Сүхбаатар, 3-р хороо, 5 хороолол, 19, 01 тоот",2015.12.23,"Гадаад худалдаа, ",1,"Санжаа.Мөнхжаргал, ",Санжаа.Мөнхжаргал,2015.12.23,,
2824795,Моннидер,"Улаанбаатар, Баянгол, 13-р хороо, 00",2007.05.08,"Гадаад худалдаа, ",2,"Жамбал.Ганбаатар, Батсүх.Хишигжаргал, ",Батсүх.Хишигжаргал,2014.03.12,"Жамбал.Ганбаатар, ",2021-06-23
4024532,Бодь энэрэл,"Увс, Улаангом, 5-р баг, 23, 24б тоот",2021.12.10,"Малын гаралтай түүхий эдийн худалдаа, Барилгын материалын худалдаа, Барилгын засвар хийх, Жимс, жимсгэнэ тариалах, Төмс, хүнсний ногоо тариалах, ",1,"Нордод.Батэрдэнэ, ",Нордод.Батэрдэнэ,2021.12.10,"Нордод.Батэрдэнэ, ",2021-12-10
8163227,Орхон аймгийн хүчний гурван төрөлт бодибилдинг фитнессийн нэгдсэн холбоо,"Орхон, Баян-Өндөр, 4-р баг, Хүрэнбулаг, 4 хороолол, Номин ТВ-ийн байранд",2015.01.20,"Хүчний гурван төрөлт спортыг хөгжүүлэх, ",2,"Ядмаа.Биндэръяа, Цолмон.Үүрцайх, ",Нямсүрэн.Отгонбаяр,2015.01.20,,
2088258,АЭ энд ЖААГ,"Улаанбаатар, Чингэлтэй, 1-р хороо, Худалдааны гудамж, Монголньюс ХХК-ий байр",2006.11.29,"Улаанбаатар хотын нутаг дэвсгэрт телевизийн өргөн нэвтрүүлгийн үйлчилгээ эрхлэх /2014.05.06-2017.05.06/, ",6,"Балдорж.Нандинтүшиг, Зориг.Алтай, Дэмчигдорж.Галсанжаргал, Лувсандамдин.Жаргалсайхан, Авирмэд.Намуужин, Данзандаржаа.Туяа, ",Намсрай.Шүр,2021.12.23,"Данзандаржаа.Туяа, Балдорж.Нандинтүшиг, ",2020-09-29
8119449,Дархан-уул аймгийн шайбтай хоккейн холбоо,"Дархан-Уул, Дархан, 10-р баг, 5-р хороолол, 1б, 69 тоот",2013.11.11,"Хоккейн спортыг орон нутагтаа сурталчлах, хөгжүүлэх, хүүхэд, залуучуудыг татан оролцуулж, тухайн төрлийн спортоор хичээлүүлж эрүүл чийрэг өсгөх., ",5,"Дүгэрсүрэн.Мөнхсайхан, Жамбал.Цогтгэрэл, Батчулуун.Анхболд, Домбожав.Буянтогтох, Гомбо.Ганхүү, ",Батчулуун.Анхболд,2013.11.11,,
3144542,Амтат арвайн буян,"Баянхонгор, Хүрээмарал, 5-р баг, Дэлгэр мөрөн, .",2023.01.27,"Хэрчсэн гурил үйлдвэрлэл, Караоке, Талх, нарийн боов үйлдвэрлэл, Цайны газар, Сүү, сүүн бүтээгдэхүүний худалдаа, Бууз, банш үйлдвэрлэл, Зочид буудлын үйлчилгээ, Хүнсний жижиглэн худалдаа, Гурил, гурилан бүтээгдэхүүний худалдаа, Сүүн бүтээгдэхүүн боловсруулах, ",1,"Чунаг.Дэнсмаа, ",Чунаг.Дэнсмаа,2023.01.27,"Чунаг.Дэнсмаа, ",2023-01-27
3125432,Баян ташаагийн эх аудит,"Улаанбаатар, Баянгол, 5-р хороо, 10-р хороолол, Техник импорт ХХК-ийн байр, 304 тоот",2011.03.31,"Аудитын үйл ажиллагаа /2014.08.21-2017.08.21/, ",1,"Тагалдар.Хоролсүрэн, ",Тагалдар.Хоролсүрэн,2011.03.31,,
