Регистр,Нэр,Хаяг,Бүртгэсэн_огноо,Үйл_ажиллагааны_чиглэл,Хувьцаа_эзэмшигчийн_тоо,Хувьцаа_эзэмшигч_гишүүд,Итгэмжлэлгүйгээр_төлөөлөх_албан_тушаалтан,ИТАТ_бүртгэсэн_огноо,Эцсийн_Өмчлөгч,ЭӨ_бүртгэсэн_огноо
3375595,Дорнодхүнс групп,"Дорнод, Хэрлэн, 6-р баг, 1, Билэг төвийн урд зүүн бүсийн хүнсний бөөний бааз 01",2013.12.24,"Хүнсний дэлгүүр эрхлэх, Гурил, гурилан бүтээгдэхүүний үйлдвэрлэл эрхлэх, Мах, махан бүтээгдэхүүний үйлдвэрлэл эрхлэх, Гадаад худалдаа эрхлэх, Сүү, сүүн бүтээгдэхүүний үйлдвэрлэл эрхлэх, Ус ундаа, жүүсний үйлдвэр эрхлэх, ",1,"Гантөмөр.Ганзориг, ",Гантөмөр.Ганзориг,2013.12.24,"Гантөмөр.Ганзориг, ",2021-01-19
6867812,Цэлмэг технологи сургалт,"Улаанбаатар, Сонгинохайрхан, 31-р хороо, хайрхан 8, 269 тоот",2022.05.13,"Мэдээлэл мехнологийн сургалтыг зохион байгуулах, чадварлаг боловсон хүчин бий болгоход дэмжлэг үзүүлэх, төсөл хөтөлбөр хэрэгжүүлэх, ижил зорилготой байгууллагуудтай хамтран ажиллах, ",3,"Жаргалсайхан.Шижир, Шагдар.Хэрлэнтунгалаг, Чимидгочоо.Батзаяа, ",Жаргалсайхан.Шижир,2022.05.13,"Жаргалсайхан.Шижир, ",2022-05-13
2708469,Шугам,"Улаанбаатар, Баянгол, 8-р хороо, 4 хороолол, 14, 100",2006.01.04,"Барилгын зураг төсөл ЗТ-2.1, ЗТ-3.8, ЗТ-5.6, ЗТ-6.3, ЗТ-6.4, ЗТ-11.1, ЗТ-11.2 заалтын дагуу, нэмэлтээр ЗТ-7.3, ЗТ-7.4, ЗТ-8.1 /2018.03.30 - 2023.03.30/, Эрчим хүчний зөвлөх үйлчилгээ, зураг төсөл боловсруулах ТЗ-8.2, ТЗ-8.4, ТЗ-8.11 заалтын дагуу үйл ажиллагаа /2021.03.05 - 2026.03.05/, Төлбөр эсвэл гэрээний үндсэн дээр хийгдэх бөөний худалдаа, Цахилгааны тоног төхөөрөмжийн худалдаа, ",3,"Баточир.Энхбаатар, Баточир.Авирмэд, Баточир.Чинзориг, ",Баточир.Чинзориг,2020.01.08,"Баточир.Энхбаатар, Баточир.Чинзориг, Баточир.Авирмэд, ",2020-01-08
2119811,Монгол кино нэгтгэл,"Улаанбаатар, Баянзүрх, 5-р хороо, жуков, Монгол кино үйлдвэр",2021.11.03,"Төрөөс кино урлагийн талаар гаргасан бодлого, шийдвэрийн хэрэгжилтийг зохион байгуулах, кино урлагийн талаар баримтлах төрийн зарим чиг үүргийг хэрэгжүүлэх болон дүрэмд заасан үйл ажиллагааг хэрэгжүүлэх, ",1,,Оросоо.Түвшиндэмбэрэл,2021.11.03,,
3000788,Аргурван гэц,"Архангай, Төвшрүүлэх, , 0",2007.01.30,"Мал эмнэлэг, үржлийн  үйлчилгээ /2007.01.15 - /, ",1,"Пүрэвдорж.Будхүү, ",Пүрэвдорж.Будхүү,2018.08.29,"Пүрэвдорж.Будхүү, ",2020-12-28
2697882,Ариунтуулай,"Өмнөговь, Даланзадгад, 3-р баг, Далан, 01",2005.12.18,"Зоогийн газар / - /, Гадаад, дотоод худалдаа, Хуурай замын ачаа тээвэрлэх үйлчилгээ, Түүхий эд авах, борлуулах, Жимсний ундаа, цэвэр ус үйлдвэрлэл, Ажлын байрны түрээс, Сантехник, авто сэлбэгийн дэлгүүрийн жижиглэн худалдаа, Хүнс, ундаа, тамхи голлосон төрөлжсөн бус барааны дэлгүүр, ",1,"Чүлтэм.Батжаргал, ",Чүлтэм.Батжаргал,2005.12.18,"Чүлтэм.Батжаргал, ",2020-10-20
6510353,Өсөх ирээдүйн зоос,"Улаанбаатар, Баянгол, 13-р хороо, 3 хороолол, ард аюушийн өргөн чөлөө, 2а, 23 тоот",2019.12.20,"Барааны дэлгүүр, Барилгын материалын худалдаа, Барьцаалан зээлдүүлэх үйлчилгээ, ",1,"Рэнцэнбат.Оюунжаргал, ",Рэнцэнбат.Оюунжаргал,2021.06.10,"Рэнцэнбат.Оюунжаргал, ",2021-06-10
2054531,Цэгээнхуст,"Сэлэнгэ, Сайхан, 3-р баг, Номгон, 1",2005.10.29,"Мал аж ахуй, Гадаад дотоод худалдаа, Газар тариалан,хадлан бэлтгэл, ",1,"Булданаа.Ганболд, ",Цэдэнбал.Алтангэрэл,2019.03.05,"Булданаа.Ганболд, ",2020-12-22
2642352,Сэлэнгэбуман буудай,"Сэлэнгэ, Шаамар, 1-р баг, Дэлгэрхаан, 1",2005.10.31,"Жимс, жимсгэнэ тариалах, Гадаад дотоод худалдаа, Мал аж ахуй, Зоогийн газар, гуанз, цайны газрын үйлчилгээ / - /, Газар тариалан,төмс хүнсний ногоо, Зөгийн аж ахуй, ",1,"Баярбаатар.Сэлэнгэ, ",Баярбаатар.Сэлэнгэ,2013.03.28,"Баярбаатар.Сэлэнгэ, ",2020-12-31
4139437,Мөнгөлөг агуйт,"Хөвсгөл, Цагаан-Үүр, 4-р баг, Булган, 4-р гудамж, 8 тоот",2016.02.03,"Мужааны зориулалттай модон материал эд анги үйлдвэрлэл, Мод, модон эдлэлийн худалдаа, Хүнсний төрөлжсөн дэлгүүрийн жижиглэн худалдаа, Арьс шир элдэх үйл ажиллагаа, Цаас болон цаасан бүтээгдэхүүн үйлдвэрлэл, Аялал жуулчлалын үйл ажиллагаа, Мод, модон эдлэлийн үйлдвэрлэл, Зочид буудлын үйл ажиллагаа, ",1,"Өлзийбаатар.Гантулга, ",Өлзийбаатар.Гантулга,2016.02.03,"Өлзийбаатар.Гантулга, ",2020-10-19
4012631,Харгайтын дамжиг,"Увс, Улаангом, 5-р баг, 8, 3 тоот",2013.11.28,"Гадаад худалдаа, Гоо сайхны барааны жижиглэн худалдаа / - /, Эмийн сангийн үйлчилгээ /2022.10.20 - 2027.10.20/, ",1,"Пүрэвжав.Басан, ",Пүрэвжав.Басан,2013.11.28,"Пүрэвжав.Басан, ",2022-11-02
3676633,Хатанцагаан тун,"Сүхбаатар, Эрдэнэцагаан, 8-р баг, Алтан овоо, 0",2012.06.14,"Эмийн худалдаа / - /, ",1,"Сундуй.Саранцэцэг, ",Сундуй.Саранцэцэг,2012.06.14,"Сундуй.Саранцэцэг, ",2020-10-14
5447836,Сийбулл,"Сэлэнгэ, Мандал, 4-р баг, Хэрх, дэнж, ,",2011.02.14,"Хүнсний  дэлгүүр, Гадаад худалдаа, Газар тариалан, ",1,"Сүхбат.Тэргэл, ",Нямдаваа.Батсайхан,2019.06.04,"Сүхбат.Тэргэл, ",2020-11-05
5330017,Брайтпэйнт,"Улаанбаатар, Баянгол, 9-р хороо, 20 тоот",2009.09.29,"Оёдол, Барилгын засвар, засал чимэглэл, Гадаад худалдаа, ",1,"Ёндон.Дэмбэрэл, ",Ёндон.Дэмбэрэл,2009.09.29,"Ёндон.Дэмбэрэл, ",2020-11-09
3678555,Өндөрхамар хоршоо,"Сүхбаатар, Баруун-Урт, 5-р баг, дэнж, дэнж 14, 1",2014.07.04,"Ноос, ноолууран бүтээгдэхүүн  үйлдвэрлэл, Хөдөө аж ахуйн болон малын гаралтай  түүхий эд худалдан ,борлуулах, ",181,"Ваанжил.Бямбадорж, Жүгдэр.Батзоригт, Жамсран.Батчимэг, Мажигсүрэн.Баатарсүх, Чимэдцэеэ.Дүгиймаа, Марийваа.Эрдэнэбилэг, Жамсран.Ганболд, Баатар.Бямба, Загдаа.Чинзориг, Бямбадорж.Пүрэвжаргал, Загдаа.Рэгзэдмаа, Шархүү.Мөнхбаяр, Бор.Эрдэнэбаяр, Гунгаа.Энхбаяр, Жигжид.Хадбаатар, Сүхбаатар.Бямбацогт, Бүлтгэр.Октябрь, Лхам.Болдбаатар, Аюуш.Моонон, Дугар.Баяраа, Баатар.Гармаабазар, Ширнэн.Жүндэр, Адъяа.Мөнхсайхан, Гомбосүрэн.Буд, Дамчаасүрэн.Батцэнгэл, Лхамжав.Батхүрэл, Батсүх.Анхбаяр, Цэвэл.Галэрдэнэ, Шинэшарав.Болдоо, Намжил.Баяраа, Гармаабазар.Баттулга, Уртнасан.Өлзийжаргал, Батхүрэл.Баярцог, Гэрэл.Отгонбаатар, Мажигсүрэн.Баатарчулуун, Гаваасамбуу.Өлзийхутаг, Гансүх.Галбаатар, Лхам.Батчулуун, Амгаланбаатар.Мөнхэрдэнэ, Дамдинжав.Амаржаргал, Лувсандондов.Батсүх, Гармаабазар.Амартайван, Батмөнх.Оюунэрдэнэ, Сайнбаяр.Мажигсүрэн, Шар.Болдоо, Дамдинсүрэн.Нямцогт, Лутжав.Батсайхан, Марийваа.Амгаланбаатар, Дамдинжав.Амартөгс, Чогдов.Мөнхбат, Ганбаатар.Пүрэвбат, Баярболд.Амарсайхан, Бямбадорж.Пүрэвням, Цэвээлэй.Баасанбат, Дугаржав.Лутбуян, Аюурзана.Отгонбор, Мөнхгэрэл.Мөнхтөр, Саарал.Баатарцогт, Лхамсүрэн.Батнасан, Намжил.Баярэрдэнэ, Ваанчинжав.Батбаяр, Энхамгалан.Амартүвшин, Дандар.Борухнай, Лхам.Баттулга, Сүхбаатар.Мөнхнаран, Бямбадорж.Пүрвээ, Дугаржав.Энхбаатар, Амгаланбаатар.Мөнхтөр, Гармаабазар.Мөнхзул, Бямбадорж.Батжаргал, Чулуунбаатар.Хүрэлбаатар, Жагдар.Дамдинжав, Марийваа.Чинзоригт, Сумъяа.Нэргүй, Бямба.Далантай, Балдан.Чулуунбат, Тэрбиш.Баярбаатар, Жагдар.Гомбодорж, Батнацаг.Эрдэнэхүү, Цэгмид.Чулуунбаатар, Дугаржав.Эрдэнэцогт, Сүхээ.Батжаргал, Цэрэндорж.Буджав, Очир.Гүрдорж, Балдан.Чулуунбадрах, Батчулуун.Батжаргал, Шагжаа.Түвшинбаяр, Өлзиймөнх.Цоггэрэл, Чулуунбаатар.Өлзийтөгс, Намжил.Баяржаргал, Иш.Аминдаваа, Аавынхүү.Буд, Лутсүх.Балжинням, Мөнхгэрэл.Энхтөр, Дашдаваа.Хүрэлсүх, Баяраа.Цагаанхүү, Жаргал.Моононсүх, Жамбаа.Балдан, Гомбожав.Отгонбаяр, Дуламрагчаа.Цогбаяр, Цэвээлэй.Баасанжав, Өлзиймөнх.Оюунгэрэл, Гонгор.Батсүх, Болдоо.Баяржавхлан, Ойдов.Амарзориг, Янсан.Нямбаатар, Буджав.Баттөгс, Өлзиймөнх.Очингэрэл, Чулуунбаатар.Хүрэлсүх, Баяраа.Өсөхбаяр, Батмөнх.Батхүү, Жамба.Анхныбаяр, Түмэн.Ойдов, Норов.Анхбаяр, Очирхуяг.Ганбат, Түвшинбаяр.Нацагдорж, Дайрий.Буджав, Аабат.Мөнхбат, Батмөнх.Содномцог, Дугаржав.Энхбаяр, Тогтох.Алтансүх, Ойдов.Амартайван, Мажигсүрэн.Сэржинбаатар, Дорж.Энхбаатар, Чимэд.Энхбаатар, Лутжав.Хүдэрбаатар, Пяранлай.Дамдинжав, Алтанцэцэг.Ганбаатар, Өлзиймөнх.Сарангэрэл, Дулам.Энхбаатар, Намжилсүрэн.Энхбат, Одонмядаг.Гантөгс, Цэдэнжав.Эрдэнэцогт, Буджав.Мягмаржав, Балдан.Чулуунжав, Намсрай.Энхтөр, Мажигсүрэн.Цэрэндоной, Амгаланбаатар.Мөнхбаяр, Амгаланбаатар.Мөнхнайрамдал, Бямбадорж.Пүрэвбаасан, Дорж.Ганбаатар, Шарав.Хасэрдэнэ, Жагдар.Доожав, Жигжид.Нэргүйбаатар, Батмөнх.Батжаргал, Цэрэндорж.Будсүрэн, Гомбочүлтэм.Лхам, Шарав.Банзрагч, Чулуунбаатар.Цэрэнчимэд, Гармаабазар.Амаржаргал, Бадамсэрээжид.Батболд, Баяраа.Одсүрэн, Сайнбаяр.Батсуурь, Магсар.Нямдаваа, Чулуунбаатар.Хүрэлчулуун, Дуламжав.Амарсанаа, Жодовиш.Дуламрагчаа, Доржготов.Мөнхбаяр, Жодовиш.Базаррагчаа, Намсрай.Энхбат, Зоригт.Төрболд, Нямцогт.Эрдэнэчулуун, Чойжилсүрэн.Оюунсүрэн, Цэдэндамба.Болд, Одонмядаг.Батөлзий, Дамдинсүрэн.Батэрдэнэ, Ядам.Баттөр, Дамдинбал.Мөнхбат, Хишигнэмэх.Баатарсүх, Мажигсүрэн.Баянмөнх, Сайнбямба.Ганбаяр, Мажигсүрэн.Мөнхбат, Цэнджав.Баттүвшин, Жамъяншарав.Нямдорж, Батэрдэнэ.Азбаяр, Бибиш.Болд, Цэдэниш.Түвшинтөгс, Цэдэниш.Эрдэнэтөгс, Энхбат.Энхмөнх, Буяндэлгэр.Ганхуяг, Цэвэгсүрэн.Лхагва, ",Жүгдэр.Батзоригт,2014.07.04,,
5608066,Эс Ай Си Ти,"Улаанбаатар, Хан-Уул, 15-р хороо, 124 тоот",2012.06.07,"Компьютерийн тоног төхөөрөмжийн худалдаа, Харилцаа холбооны тоног төхөөрөмжийн худалдаа, засвар үйлчилгээ, Шилэн кабелийн засвар үйлчилгээ, Электроникийн худалдаа, засвар үйлчилгээ, Программ хангамжийн үйл ажиллагаа, Гадаад худалдаа, ",1,"Энхболд.Болдхүү, ",Энхболд.Болдхүү,2012.06.14,"Энхболд.Болдхүү, ",2020-12-23
5780594,Ихсувади,"Улаанбаатар, Сонгинохайрхан, 30-р хороо, чулуут 6, 25 тоот",2013.12.13,"Газар тариалан эрхлэх, Барилгын засвар, засал чимэглэл, Гадаад худалдаа, ",1,"Бороохой.Даваасүрэн, ",Бороохой.Даваасүрэн,2013.12.13,"Бороохой.Даваасүрэн, ",2020-10-16
3251179,Ентүм трейвэл,"Говь-Алтай, Есөнбулаг, 1-р баг, Баянхайрхан, 1 гудамж , 4 тоот ",2016.06.24,"Аялал, жуучлал, Рестораны үйлчилгээ, Зочид буудлын үйлчилгээ, ",1,"Туваанжав.Гантөмөр, ",Туваанжав.Гантөмөр,2020.12.19,"Туваанжав.Гантөмөр, ",2020-12-19
6986986,Тэвэг ворлд медиа монголиа,"Улаанбаатар, Сүхбаатар, 20-р хороо, цолмонгийн 12, 24а тоот",2023.01.31,"Дуу, дүрс бичлэг хийх, Веб сайтын үйлчилгээ, Хэвлэлийн үйлдвэр, ",1,"Баатарсүрэн.Цолмонбаяр, ",Баатарсүрэн.Цолмонбаяр,2023.01.31,"Баатарсүрэн.Цолмонбаяр, ",2023-01-31
3870677,Баян тариалан,"Төв, Борнуур, 2-р баг, Мандал, пүүний дэнж 6, 94",2017.01.13,"Мал аж ахуй, Мах, махан бүтээгдэхүүний үйлдвэрлэл, Хүнсний ногоо тариалах, Гадаад худалдаа, Талх, нарийн боов үйлдвэрлэл, ",1,"Цэрэндаш.Батбаяр, ",Цэрэндаш.Батбаяр,2017.01.13,,
4138821,Үлэмж итгэл,"Хөвсгөл, Мөрөн, 8-р баг, 16-р байр 43",2015.09.15,"Эмийн сангийн үйлчилгээ /2019.11.16 - 2024.11.16/, Хүнсний төрөлжсөн дэлгүүрийн жижиглэн худалдаа, ",1,"Мишигдорж.Байгалмаа, ",Мишигдорж.Байгалмаа,2015.09.15,"Мишигдорж.Байгалмаа, ",2020-10-14
6559565,Азуре хүлүг аудит,"Улаанбаатар, Хан-Уул, 3-р хороо, үйлдвэр, 43б, 222 тоот",2020.04.17,"Аудитын үйл ажиллагаа эрхлэх /2020.07.10 - 2023.07.10/, ",1,"Ганэрдэнэ.Мөнхбаяр, ",Ганэрдэнэ.Мөнхбаяр,2020.04.17,"Ганэрдэнэ.Мөнхбаяр, ",2022-06-13
3860086,Замбативийн шим,"Төв, Баянцогт, 2-р баг, Сарлаг, Дулаан хошуу 01",2010.04.02,"Газар тариалан эрхлэх, Гадаад худалдаа, Таван хошуу мал,  сүүний фермийн үйл ажил, ",2,"Жамсран.Рэнцэнамгалан, Цогалдар.Баатаржаргал, ",Жамсран.Рэнцэнамгалан,2010.04.02,"Жамсран.Рэнцэнамгалан, ",2020-12-23
2644401,Жоншт,"Хэнтий, Хэрлэн, 5-р баг, Өндөрхаан, т172, 03 тоот",2007.10.09,"Нүдний үзлэг, оношлогоо, эмчилгээ, Барилга угсралт /2013.02.18 - 2016.02.18/, Хүнсний барааны дэлгүүр, ",1,"Даваажав.Энхтайван, ",Даваажав.Энхтайван,2020.05.04,"Даваажав.Энхтайван, ",2020-05-04
5151198,Нөблмэн,"Улаанбаатар, Сүхбаатар, 5-р хороо, 18 тоот",2007.07.06,"Гадаад худалдаа, Хэвлэлийн үйлдвэрлэл, ",1,"Сосорбарам.Лхагвасүрэн, ",Сосорбарам.Лхагвасүрэн,2014.01.10,"Сосорбарам.Лхагвасүрэн, ",2020-12-18
4064844,Мөнхбаян эрдэнэ,"Ховд, Жаргалант, 6-р баг, Жаргалан, 1-1 тоот",2008.05.26,"Гэр ахуйн барааны худалдаа, Аялал, жуулчлалын агентлагийн үйл ажиллагаа, Аялал жуулчлалын бааз, Барилга угсралтын ажил / - /, Эвдэрсэн газрын техникийн болон биологийн нөхөн сэргээлт хийх, Барилгын материалын жижиглэн худалдаа, ",1,"Мөнхсүлд.Цэндсүрэн, ",Мөнхсүлд.Цэндсүрэн,2009.12.14,"Мөнхсүлд.Цэндсүрэн, ",2021-03-15
6253288,Инвескор проперти,"Улаанбаатар, Сүхбаатар, 1-р хороо, 13-р хороолол /14230/, парисын, 42 дугаар барилгын 12 давхар, 1201 тоот",2017.11.29,"Үл хөдлөх эд хөрөнгө, түүнтэй холбоотой эрхийг түрээслүүлэх,түрээслэх,хөлслүүлэх, хөлслөх / - /, Хорооноос үл хөдлөх эд хөрөнгө зуучлалын үйл ажиллагаанд хамаарна гэж үзсэн бусад үйлчилгээ/бусад компаниудын санхүүжүүлэх үл хөдлөх эд хөрөнгийг худалдан борлуулах/ / - /, Тусгай зөвшөөрлийн хавсралтад заасан үл хөдлөх эд хөрөнгийн зуучлалын байгууллагын үйл ажиллагаа, Үл хөдлөх эд хөрөнгө,түүнтэй холбоотой эрхийг худалдах, худалдан авах,шилжүүлэх / - /, Үл хөдлөх эд хөрөнгийн менежмент / - /, Үл хөдлөх эд хөрөнгийг худалдан авч,засварлах,борлуулах / - /, ",1,".Эс Ай Би Жэй Капитал, ",Отгонсүх.Уянга,2020.04.16,"Батбаяр.Мөнхочир, Баянмөнх.Анхболд, ",2020-05-26
5861225,Тэлмэнхалиун,"Улаанбаатар, Хан-Уул, 4-р хороо, наадамчдын зам, 1204, 69 тоот",2014.07.16,"Ариутгал халдваргүйжүүлэх бодис импортлох, ханган нийлүүлэх /2021.10.24 - 2026.10.24/, Ахуйн шавьж, мэрэгч устгал, халдваргүйжүүлэлтийн үйлчилгээ /2021.02.16 - 2024.02.16/, Эмчилгээний гоо засал /2022.08.01 - 2025.08.01/, Эмнэлгийн хэрэгсэл, багаж тоног төхөөрөмж, дагалдах хэрэгсэл, импортлох, ханган нийлүүлэх /2020.11.27 - 2023.11.27/, ",1,"Болдбаатар.Доржханд, ",Болдбаатар.Доржханд,2020.03.30,"Болдбаатар.Доржханд, ",2020-03-30
Тохирох мэдээлэл олдсонгүй,,,,,,,,,,
3188442,Хурмастын хүлэг,"Булган, Булган, 5-р баг, Жаргалант, Магсаржавын гудамж, ХАА-н хоршоологчдын холбооны байр",2011.09.05,"Гадаад худалдаа, Барилга угсралт /2013.11.21 - 2016.11.21/, Блок үйлдвэрлэл, Барилгын гадна тохижилтын үйлчилгээ, Барьцаалан зээлдүүлэх үйлчилгээ, ",1,"Ганпүрэв.Ганзориг, ",Ганпүрэв.Ганзориг,2014.11.20,"Ганпүрэв.Ганзориг, ",2020-12-28
9086331,Эрүүл мэндийн хөгжлийн төв,"Улаанбаатар, Сүхбаатар, 1-р хороо, 202",2009.04.07,"Эрүүл мэндийн удирдлагыг боловсронгуй болгох, статистик, мэдээлэл, сургалт зайн оношлогоо, судалгаа хийх, ",1,,Баярмагнай.Нарантуяа,2019.08.23,,
3247015,Хярын улаан,"Говь-Алтай, Есөнбулаг, 7-р баг, Жинст, 9 -р гудамж 6 -р байр 1 тоот",2012.02.15,"Хүнсний дэлгүүр, Хуурай замаар хийгдэх ачаа тээвэр, ",1,"Өлзий.Ганзориг, ",Өлзий.Ганзориг,2012.02.15,"Өлзий.Ганзориг, ",2020-02-03
6001246,Тэргүүн сүрэг трейд,"Улаанбаатар, Чингэлтэй, 5-р хороо, 6 хороолол, Тусгаар тогтнолын талбай Виктори центр Б корпус 501 тоот",2015.09.09,"Малын тэжээлийн үйлдвэрлэл, худалдаа, Малын ээмэгний үйлдвэрлэл, Гадаад худалдаа, ",1,"Мөнхбат.Энход, ",Мөнхбат.Энход,2016.09.07,"Мөнхбат.Энход, ",2020-10-20
3496511,Доонобашаа,"Завхан, Улиастай, 1-р баг, Жинст, 2-18 тоот",2012.05.24,"Газар тариалан эрхлэх, Гадаад худалдаа, Хүнсний  худалдаа, Зочид буудлын үйлчилгээ, ",1,"Дамдинсүрэн.Анхтэс, ",Тангад.Мөнхцэцэг,2014.06.13,"Дамдинсүрэн.Анхтэс, ",2022-10-21
3648648,Тэнгэр нуур мета,"Өмнөговь, Ханбогд, 1-р баг, Номгон, шар дов 3, 3 тоот",2022.05.06,"Агуулахын үйл ажиллагаа / - /, Төлбөр эсвэл гэрээний үндсэн дээр хийгдэх бөөний худалдаа, Хуурай замаар хийгдэх ачаа тээвэр, ",1,"Гантөмөр.Нандинбаяр, ",Гантөмөр.Нандинбаяр,2022.05.06,"Гантөмөр.Нандинбаяр, ",2022-05-06
5585317,Идеадэвэлопмент,"Улаанбаатар, Баянзүрх, 14-р хороо, 408 тоот",2012.04.09,"Программ хангамжийн зөвлөгөө өгөх, Программ хангамжийн үйл ажиллагаа, ",6,"Цэндаюуш.Галбадрах, Чулуунхүү.Энхтүвшин, Уламбаяр.Ренчинсүрэн, Батсүх.Чинзориг, Дамдинсүрэн.Энхбаяр, Алдаргавъяат.Мөнхэрдэнэ, ",Ням.Батцэрэн,2012.04.09,,
4081307,Алтайн сүрлэг цамхаг,"Ховд, Жаргалант, 7-р баг, Магсаржав, шшга 24 айл, 18 тоот",2016.11.14,"Гадаад худалдаа, ",1,"Даваасамбуу.Батсайхан, ",Даваасамбуу.Батсайхан,2016.11.14,,
