Регистр,Нэр,Хаяг,Бүртгэсэн_огноо,Үйл_ажиллагааны_чиглэл,Хувьцаа_эзэмшигчийн_тоо,Хувьцаа_эзэмшигч_гишүүд,Итгэмжлэлгүйгээр_төлөөлөх_албан_тушаалтан,ИТАТ_бүртгэсэн_огноо,Эцсийн_Өмчлөгч,ЭӨ_бүртгэсэн_огноо
3553426,Өв оюу илч,"Өвөрхангай, Арвайхээр, 5-р баг, Арвайхээр, 13",2009.09.18,"Дулааны эрчим хүч боловсруулах, ",1,"Лонжид.Батжаргал, ",Лонжид.Батжаргал,2009.09.18,"Лонжид.Батжаргал, ",2020-12-24
5040566,ДНТ,"Улаанбаатар, Баянгол, 3-р хороо, 2",2006.01.19,"Барилгын зураг төсөл / - /, Гадаад худалдаа, ",1,"Лувсандорж.Энхсайхан, ",Лувсандорж.Энхсайхан,2006.01.19,"Лувсандорж.Энхсайхан, ",2020-10-20
4192338,Биндэрнийтлэг үйлчилгээ,"Хэнтий, Биндэр, 5-р баг, Онон, 0 тоот",2014.09.03,"Дулаан түгээх үйл ажиллагаа /2020.03.13 - 2025.03.13/, Хоол үйлдвэрлэл, Дулаан үйлдвэрлэл /2020.03.13 - 2025.03.13/, Ус хуримтлуулах, ариутгах, түгээх үйл ажиллагаа, Сумын тохижилт, шугам сүлжээний ашиглалт, хамгаалалт, цэвэр усны хангамж, хогны менежментийн асуудлыг зохицуулах, хэрэгжүүлэх, хяналт тавих, Хуурай замаар хийгдэх тээвэр, ",1,"Зоригт.Ононбаяр, ",Гантөмөр.Баярхүү,2020.08.24,,
8088233,Монголын аялал жуулчлалын холбоо,"Улаанбаатар, Сүхбаатар, 1-р хороо, ренчингийн гудамж, 33-р байр 2-16 тоот",2012.09.27,"Монголын аялал жуулчлалын хөгжил хувь нэмрээ оруулах, гишүүдийнхээ эрх ашгийг хамгаалах, ",1,"Цэвэлмаа.Баярсайхан, ",Дамба.Гантөмөр,2022.05.24,"Дамба.Гантөмөр, ",2020-09-03
6615945,Интерблю,"Улаанбаатар, Сүхбаатар, 11-р хороо, рашаан 20, 18 тоот",2020.09.08,"Тавилга худалдаа, Онлайн худалдаа, Тавилга үйлдвэрлэл, Тавилгын түрээс, ",1,"Шинэн.Төгсбаяр, ",Шинэн.Төгсбаяр,2023.01.20,"Шинэн.Төгсбаяр, ",2023-01-20
3126277,Энхмөнх богд,"Баянхонгор, Баянхонгор, 1-р баг, Номгон, 0",2012.03.14,"Хүнс, ундаа, тамхины төрөлжсөн дэлгүүрийн жижиглэн худалдаа, Дулаан үйлдвэрлэл, зохицуулалттай хангах үйл ажиллагаа, Сүүн бүтээгдэхүүн үйлдвэрлэл, Зоогийн газар, гуанз, цайны газрын үйлчилгээ / - /, ",1,"Сэрээ.Мөнхөлзий, ",Сэрээ.Мөнхөлзий,2016.10.21,"Сэрээ.Мөнхөлзий, ",2020-05-15
2655519,Хайрханнаран трейд,"Улаанбаатар, Баянзүрх, 18-р хороо, 13 хороолол, 12, 138 тоот",2006.06.29,"Гадаад худалдаа, Бүх төрлийн оёдол, 0.4-35 кВ-ын цахилгаан дамжуулах шугам, дэд станцын засвар, угсралт, түүний туршилт тохируулга, дагалдах ажил үйлчилгээ /2016.02.08 - 2019.02.08/ /2012.10.30 - 2015.10.30/, ",1,"Батаа.Басбиш, ",Батаа.Басбиш,2006.06.29,,
2162342,Хэрлэндом,"Хэнтий, Хэрлэн, 1-р баг, Хэрлэн, 01",2007.07.30,"Өрхийн эмнэлэгийн тусламж /2002.02.02 - /, Гоо сайханы үйлчилгээ / - /, Дотооп шүүрлийн булчирхай амбулаторийн үйлчилгээ /2002.02.02 - /, ",7,"Жамсранжав.Хонгорзул, Шаравжамц.Отгонтуяа, Цэнддогсом.Наранцэцэг, Лувсанжамба.Алтанчимэг, Чулуунбат.Чаминчулуун, Баатархуяг.Номуундарь, Баатарчулуун.Наранцэцэг, ",Жамсранжав.Хонгорзул,2010.07.06,"Жамсранжав.Хонгорзул, ",2020-02-27
6928293,Тулга инфинити вэйв,"Улаанбаатар, Баянзүрх, 5-р хороо, 15 хороолол, 202, 4 тоот",2022.09.30,"Хэвлэх үйлдвэр, Гоо сайхны үйлчилгээ, Санхүүгийн тайлан баланс гаргах, түүнтэй холбоотой зөвлөгөө өгөх, Төлбөр эсвэл гэрээний үндсэн дээр хийгдэх бөөний худалдаа, Хэвлэлийн эх бэлтгэх, Хүнсний бөөний болон жижиглэнгийн худалдаа, ",1,"Сүхбаатар.Баасандорж, ",Сүхбаатар.Баасандорж,2022.10.03,"Сүхбаатар.Баасандорж, ",2022-10-03
5212472,Тунгалаг-Онги,"Улаанбаатар, Сүхбаатар, 8-р хороо, 21",2008.03.28,"Гадаад худалдаа, ",1,"Цогбадрах.Ренчинханд, ",Цогбадрах.Ренчинханд,2012.04.04,"Цогбадрах.Ренчинханд, ",2020-10-17
6513964,ДЭС импекс,"Улаанбаатар, Хан-Уул, 15-р хороо, үйлдвэр туул гол, 25, 3 тоот",2019.12.30,"Түргэн хоолны худалдаа, Хүнсний бөөний худалдаа, Хүнсний ногоо тариалалт, Төлбөр эсвэл гэрээний үндсэн дээр хийгдэх бөөний худалдаа, Гурил гурилан бүтээгдэхүүний үйлдвэрлэл, Онлайн худалдаа, Цайны газар, Жимс, жимсгэний мод, бут, сөөг тариалах, Цэцэрлэгжүүлэлт, Автомашины түрээсийн үйлчилгээ, Талх, нарийн боов үйлдвэрлэл, худалдаа, Хүлэмжийн аж ахуй, Бууз баншны үйлдвэрлэл, ",1,"Алгаа.Энхбаатар, ",Алгаа.Энхбаатар,2021.10.19,"Алгаа.Энхбаатар, ",2021-10-19
5027357,ДЕС,"Улаанбаатар, Баянгол, 4-р хороо, 47",2005.11.03,"Төлбөр эсвэл гэрээний үндсэн дээр хийгдэх бөөний худалдаа, Эм болон эмнэлгийн хэрэгсэл, тоног төхөөрөмж, шүдний материал ханган нийлүүлэх /2018.05.04 - 2023.05.04/, ",1,"Хаш.Болормаа, ",Хаш.Болормаа,2005.11.03,"Хаш.Болормаа, ",2020-12-22
2160544,Буянт-Өрх,"Ховд, Жаргалант, 5-р баг, Буянт, 1",2006.05.24,"Эрүүл мэндийн анхан шатны тусламж эмчилгээ /2002.04.14 - /, ",4,"Бактияр.Саветхан, Дамдин.Отгонпүрэв, Баянжаргал.Эрдэнэчимэг, Батсүх.Жавзмаа, ",Баянжаргал.Эрдэнэчимэг,2017.04.20,"Баянжаргал.Эрдэнэчимэг, ",2020-10-18
5066018,Инносолюшн,"Улаанбаатар, Хан-Уул, 8-р хороо, 632",2006.06.05,"Программ хангамжийн үйл ажиллагаа, Гадаад худалдаа, Компьютерийн засвар, үйлчилгээ, Интернэт худалдаа, Мэдээлэл технологийн зөвлөх үйлчилгээ, Үйлдвэрийн тоног төхөөрөмжийн автоматжуулалтын үйл ажиллагаа, ",2,"Болдбаатар.Мөнхсайхан, Тэрбиш.Магсаржав, ",Тэрбиш.Магсаржав,2013.06.10,"Болдбаатар.Мөнхсайхан, Тэрбиш.Магсаржав, ",2021-06-24
2167522,Өөдрөг энх өрхийн эрүүл мэндийн төв,"Улаанбаатар, Сүхбаатар, 4-р хороо, энх тайвны өргөн чөлөө, өөрийн байранд",2010.03.17,"Өрхийн эмнэлгийн үйл ажиллагаа/2015.04.16-2018.04.16/ /2009.12.26 - /, ",9,"Дамдинсүрэн.Янжинцэцэг, Нямдэлэг.Мөнхтуяа, Мишигдорж.Чулуунхүү, Оргил.Отгонлхагва, Бизъяа.Лхагвамаа, Одсүрэн.Одгариг, Нямаа.Гүржид, Шарав.Должин, Түмэнөлзий.Гоёчимэг, ",Түмэнөлзий.Гоёчимэг,2022.05.26,"Шарав.Должин, ",2020-06-11
5531829,Зэдпрожект,"Улаанбаатар, Сүхбаатар, 11-р хороо, 7 хороолол, ногоон нуур, 101- барилга, 1606 тоот",2011.11.11,"Төлбөр эсвэл гэрээний үндсэн дээр хийгдэх бөөний худалдаа, ЗТ-2.1, ЗТ-6.1, ЗТ-6.2, ЗТ-6.3, ЗТ-6.4, ЗТ-4.1, ЗТ-11.2 заалтын дагуу /2020.02.17-2025.02.17/, ",1,"Дондовцэрэн.Дөлгөөн, ",Дондовцэрэн.Дөлгөөн,2021.12.28,"Дондовцэрэн.Дөлгөөн, ",2021-12-28
5540771,Уудамсайхан,"Улаанбаатар, Сонгинохайрхан, 18-р хороо, 73 тоот",2011.12.09,"Малын эмийн худалдаа / - /, Гадаад худалдаа, Газар тариалан эрхлэх, ",1,"Өлзийсайхан.Ариунболд, ",Өлзийсайхан.Ариунболд,2018.12.24,,
2016745,Гурванмөнх,"Өмнөговь, Баяндалай, 3-р баг, Төхөм, 02",2005.11.27,"Барилгын материалын жижиглэн худалдаа, Барилгын шаазан, вааран эд анги үйлдвэрлэл, Гадаад, дотоод худалдаа, Цахилгаан, дулаан үйлдвэрлэх, дамжуулах, хуваарилах үйл ажиллагаа /2012.12.25-2017.12.25/ /2012.12.25 - 2017.12.25/, ",1,".Өмнөговь Аймгийн Иргэдийн Төлөөлөгчдийн Хурал, ",Түвшинтөр.Эрдэнэбаатар,2020.10.16,,
6186351,Очит ЭГБ,"Улаанбаатар, Налайх, 1-р хороо, уурхайчид 18, 633 тоот",2017.05.16,"Барилгын материалын худалдаа, Нүүрсний жижиглэн худалдаа, Гадаад хэлний түр сургалт явуулах, Авто машины түрээс, Аялал жуулчлал, Онлайн худалдаа, Барьцаалан зээлдүүлэх үйлчилгээ, Урлаг соёлын арга хэмжээ зохион байгуулах, ",1,"Ганболд.Энхзул, ",Ганболд.Энхзул,2017.05.16,"Ганболд.Энхзул, ",2021-01-07
5871999,Хитхаус,"Улаанбаатар, Баянзүрх, 2-р хороо, 1б хэсэг б.доржийн, 13/2, 21",2014.08.20,"Авто машины худалдаа, Барилгын засвар, Гадаад худалдаа, Барилгын материалын худалдаа, ",1,"Бямбаноров.Сонинбаяр, ",Бямбаноров.Сонинбаяр,2014.08.20,"Бямбаноров.Сонинбаяр, ",2022-06-03
3244644,Говь-Алтай аймгийн Эрдэнэ сумын эрчим хүч,"Говь-Алтай, Эрдэнэ, 4-р баг, Өлзийт, 0",2005.12.26,"Уур үйлдвэрлэл, халуун ус хангамж, ",1,"Бүнчин.Буяндэлгэр, ",Алгаа.Мягмаржав,2021.12.08,"Базаррагчаа.Нарантуяа, ",2020-10-08
6019897,Гөү смарт ТМ,"Улаанбаатар, Баянгол, 18-р хороо, 4 хороолол, жалханц хутагт дамдинбазар, 67, 36 тоот",2015.11.13,"Онлайн худалдаа, Гадаад худалдаа, Бизнесийн чиглэлээр зөвлөгөө өгөх, Мэдээллийн технологи, програм хангамж, интернетийн үйлчилгээ, ",3,"Ганзүрх.Гантөмөр, Бүрэндүүрэн.Хатанбаатар, Ганзүрх.Ганбат, ",Ганзүрх.Ганбат,2015.11.13,"Ганзүрх.Ганбат, ",2020-10-08
6473199,Бэсүжин констракшн,"Улаанбаатар, Налайх, 5-р хороо, гандан уул 1а, 5 тоот",2019.09.20,"Сантехникийн тоног төхөөрөмжийн худалдаа, Газар тариалан эрхлэх, Хүнсний дэлгүүр, Төсөл хөтөлбөр хэрэгжүүлэх, Цэцэрлэгжүүлэлт, Мод, модон бүтээгдэхүүний худалдаа, Фермерийн аж ахуй эрхлэх, Худалдааны зуучлал, Барилгын засвар хийх, Мод, модон бүтээгдэхүүний үйлдвэрлэл, ",1,"Батбаяр.Батмагнай, ",Батбаяр.Батмагнай,2023.01.02,,
2150832,Энх-Алтай өрхийн эрүүл мэндийн төв,"Говь-Алтай, Есөнбулаг, 2-р баг, Баяншанд, 0",2008.05.26,"Эрүүл мэндийн байгууллагын бүх төрлийн мэргэжлийн үйл ажиллагаа /2015.12.18 - 2023.12.18/, ",6,"Бямбажав.Шүрэнцэцэг, Жаргал.Батбаяр, Энхтайван.Бямбачулуун, Батсайхан.Наранцэцэг, Ойдов.Биндэръяа, Олонбаяр.Долгормаа, ",Ойдов.Биндэръяа,2021.12.06,"Ойдов.Биндэръяа, ",2021-12-06
5404673,Налайх дүүргийн цэцэрлэгжүүлэлтийн алба,"Улаанбаатар, Налайх, 2-р хороо, .",2010.09.07,"Дүүргийн ногоон байгууламжийн арчлалт, тордолт, мод үржүүлэг, Цэцэрлэгжүүлэт, ",1,".Налайх Дүүргийн Засаг Даргын Тамгын Газар, ",Оюун.Уранчимэг,2017.06.28,"Оюун.Уранчимэг, ",2020-12-31
2168685,Цэдэн эрдэнэ өрхийн эрүүл мэндийн төв,"Улаанбаатар, Баянзүрх, 15-р хороо, 13 хороолол, 6-р байрны баруун талын хорооны цогцолбор байранд",2012.06.29,"Өрхийн эрүүл мэндийн төвийн үйл ажиллагаа /2015.04.24-2018.04.24 / /2012.04.24 - 2015.04.24/, ",10,"Лхасүрэн.Болорцэцэг, Цэрэндаш.Гэрэл, Балдорж.Оюуномин, Даваадорж.Наранцэцэг, Батсүх.Наранцэцэг, Сайнсүх.Энхэрдэнэ, Эрдэнэбат.Баярмаа, Ганөлзий.Нямжаргал, Батсайхан.Золзаяа, Өлзийхутаг.Хандармаа, ",Сайнсүх.Энхэрдэнэ,2020.03.06,"Сайнсүх.Энхэрдэнэ, Сайнсүх.Энхэрдэнэ, ",2020-03-06
6331734,Хаш хур,"Улаанбаатар, Баянзүрх, 12-р хороо, 203 тоот",2018.07.27,"Сүү сүүн бүтээгдэхүүн үйлдвэрлэл, Сүү сүүн бүтээгдэхүүн худалдаа, Мах, махан бүтээгдэхүүн үйлдвэрлэл, Хөдөө аж ахуйн түүхий эдийн худалдаа, Мах, махан бүтээгдэхүүний худалдаа, ",2,"Жигжидсүрэн.Оюунцэцэг, Эрдэнэхүү.Наранбаатар, ",Жигжидсүрэн.Оюунцэцэг,2018.07.27,"Жигжидсүрэн.Оюунцэцэг, Эрдэнэхүү.Наранбаатар, ",2022-12-19
8102155,Багахангай тохижилт,"Улаанбаатар, Багахангай, 1-р хороо, Энгүүн эгшиг ХХК-н байр",2013.04.08,"Гэрэлтүүлэг, цахилгаан тоног төхөөрөмжийн угсралт, засвар үйлчилгээ, Хог хаягдлыг ангилан ялгах, зөөж тээвэрлэх, хогийн нэгдсэн цэгийн үйл ажиллагаа, Тохижилт, барилгын засвар хийх, Дүүргийн нийтийн эзэмшлийн зам талбайн цэвэрлэгээ, үйчилгээ, Ногоон байгууламжийн арчилгаа, усалгаа, ",1,"Ххх.Итх, ",Бузанков.Гэрэлмаа,2022.01.21,,
3007855,Газрын гагнаас,"Архангай, Эрдэнэбулган, 2-р баг, 36, 00, 0",2014.04.29,"Блокны үйлдвэрлэл, Худалдаа үйлчилгээ, Барилгын материалын худалдаа, Гадаад дотоод худалдаа, ",2,"Дагваочир.Эрдэнэцогт, Пүрэвсүрэн.Батцэцэг, ",Дагваочир.Эрдэнэцогт,2014.04.29,"Дагваочир.Эрдэнэцогт, Пүрэвсүрэн.Батцэцэг, ",2022-02-14
Тохирох мэдээлэл олдсонгүй,,,,,,,,,,
2105314,ББ од,"Орхон, Баян-Өндөр, 12-р баг, Булаг, задгайд",2005.11.01,"Барьцаалан зээлдүүлэх үйлчилгээ, Аялал, жуулчлал, Зорчигч тээврийн үйлчилгээ, Хүнсний дэлгүүр, Такси үйлчилгээ, Ачаа тээвэр, Газар тариалан, мал аж ахуй хослон эрхлэх үйл ажил, Хот хоорондын зорчигч тээвэр, шуудан тээвэрлэлтийн үйлчилгээ, Барааны дэлгүүр, Дулаан зогсоол / - /, Авто сургалт / - /, Автомашины засвар үйлчилгээ, ",2,"Шагдар.Оюунбат, Дондов.Дэлгэрмаа, ",Оюунбат.Болортунгалаг,2023.01.27,"Дондов.Дэлгэрмаа, ",2023-01-27
5337216,Ньюкомпас,"Улаанбаатар, Хан-Уул, 2-р хороо, 19 хороолол, 31, 10",2009.11.03,"Гадаад худалдаа, Компьютерийн  худалдаа, Худалдааны зуучлал, Мэдээлэл технологийн үйл ажиллагаа, Программ хангамж боловруулах, Сэргээгдэх эрчим хүчний тоног төхөөрөмжийн худалдаа, ",2,"Ренчин.Мөнхбат, Найдан.Цогтбаяр, ",Ренчин.Мөнхбат,2022.11.27,"Найдан.Цогтбаяр, Ренчин.Мөнхбат, ",2022-11-27
3324591,Хамарын хийдийн тусгай хамгаалалттай газрын захиргаа,"Дорноговь, Сайншанд, 2-р баг, дэнж 1, 110, 0",2022.01.24,"Байгаль орчныг хамгаалах хөтөлбөрийн удирдлага, Хог хаягдлыг цэвэрлэх, устгах үйл ажиллагааны удирдлага, Богино хугацаагаар байр, сууцаар хангах үйл ажиллагаа, Ресторан, хүнсний явуулын үйлчилгээ, Аялал жуулчлалыг хөгжүүлэх, операторын үйл ажиллагаа, ",1,".Дорноговь Аймгийн Иргэдийн Төлөөлөгчдийн Хурал, ",Шоовдор.Байгалмаа,2022.01.24,,
2567075,Тулгатехник,"Улаанбаатар, Сүхбаатар, 7-р хороо, их тойруу, 1/1 байр, 1 давхар, 21.1.1 тоот",2006.11.15,"Төлбөр эсвэл гэрээний үндсэн дээр хийгдэх бөөний худалдаа, Гэр ахуйн цахилгаан хэрэгсэлийн засвар, үйлчилгээ, Худалдаа, нийтийн хоолны тоног төхөөрөмжийн засвар үйлчилгээ, угсралт, Худалдаа, нийтийн хоолны тоног төхөөрөмж, сэлбэг хэрэгсэлийн дэлгүүр, ",1,"Чимэд.Байгалмаа, ",Чимэд.Байгалмаа,2006.11.15,"Чимэд.Байгалмаа, ",2020-12-25
3014827,Эрдэнэмандал хөгжлийн дэд бүтэц,"Архангай, Эрдэнэмандал, 6-р баг, Өлзийт, ЗДТГ байр",2021.09.21,"Нийтийн аж ахуй, ",1,".Архангай Аймгийн Эрдэнэмандал Сумын Засаг Даргын Тамгын Газар, ",Алтанхуяг.Нямбилэг,2021.09.21,,
5337526,Нарлагхөхий,"Улаанбаатар, Чингэлтэй, 16-р хороо, согоотын 2, 32 тоот",2009.11.04,"Гадаад худалдаа, Автомашины худалдаа, Автомашины засвар үйлчилгээ, ",2,"Баярхүү.Мөнхбат, Мөнхөө.Одгэрэл, ",Баярхүү.Мөнхбат,2013.12.24,"Баярхүү.Мөнхбат, ",2020-10-10
2160145,Баатархайрхан-Өрх,"Ховд, Жаргалант, 2-р баг, Баатархайрхан, Өөрийн байранд",2006.06.07,"Өрхийн хүн амд эрүүл мэндийн болон эмнэлгийн тусламж үйлчилгээ үзүүлэх /2002.04.14 - /, ",8,"Намнандорж.Отгонцэцэг, Цэнджав.Отгонзаяа, Ширнэн.Цээлээсүрэн, ., Төмөржав.Отгонхүү, Амарсайхан.Оюунгэрэл, Батхүү.Энхмаа, Сүхтулга.Ундармаа, ",Цэнджав.Отгонзаяа,2021.01.05,"Цэнджав.Отгонзаяа, ",2021-01-05
4075374,Элбэггүн,"Ховд, Жаргалант, 4-р баг, Бугат, 4, - 23 тоот",2013.07.25,"Барилгын материалын худалдаа, Барилгын блок үйлдвэрлэл, Хуурай замаар хийгдэх ачаа тээвэр, Барилга угсралт /2014.04.04 - 2017.04.04/, ",1,"Морх.Амарсанаа, ",Амарсанаа.Чинзориг,2022.12.15,"Морх.Амарсанаа, ",2022-12-06
5201209,Юу Би Жи,"Улаанбаатар, Баянзүрх, 5-р хороо, өлгий 25, 521",2008.02.21,"Программ хангамжийн үйл ажиллагаа, Хүнсний дэлгүүр, Мах, махан бүтээгдэхүүний үйлдвэрлэл, худалдаа, Тавилгын үйлдвэрлэл, худалдаа, Барилгын засвар, Автомашинаар ачаа тээвэрлэх, ",1,"Халтар.Сонинхүү, ",Халтар.Сонинхүү,2018.08.09,"Халтар.Сонинхүү, ",2020-12-29
4015975,Таван тэсийн илч,"Увс, Тэс, 6-р баг, ,",2015.11.17,"Дулааны эрчим хүч, цэвэр усаар хангах, бохир ус татан зайлуулах, ",1,".Увс Аймгийн Иргэдийн Төлөөлөгчдийн Хурал, ",Галсандорж.Цэвээнжав,2021.04.05,,
2631903,ЭБУС,"Сэлэнгэ, Сүхбаатар, 3-р баг, Салхит, 1",2005.10.10,"Чих хамар хоолойн эмнэлэг,зүү төөнүүр /2003.07.04 - /, Эм, гоо сайхны барааны жижиглэн худалдаа / - /, Гадаад дотоод худалдаа, ",1,"Чойжав.Эрдэнэчимэг, ",Чойжав.Эрдэнэчимэг,2005.10.10,,
3569381,Ачу ЗСҮ,"Өвөрхангай, Арвайхээр, 5-р баг, Арвайхээр, 4, 1-1 тоот",2021.12.08,"Авто машинаар ачаа тээвэрлэх, Барилгын засал, чимэглэл, Хүнсний бүтээгдэхүүний худалдаа, үйлчилгээ, ",1,"Чулуунхүү.Батбямба, ",Чулуунхүү.Батбямба,2021.12.08,"Чулуунхүү.Батбямба, ",2021-12-08
3552489,Баяндөхөмийн хурд,"Өвөрхангай, Арвайхээр, 5-р баг, Арвайхээр, 4 тоот",2008.03.19,"Төмс , хүнсний ногоо тариалах, Барилгын тоосго , блок  үйлдвэрлэх, Малын тэжээл  тариалах, Барилгын засвар, Төмөрлөг бус эрдэс бодисоор хийсэн эдлэл үйлдвэрлэх, Гадаад , дотоод худалдаа / - /, Хөдөө аж ахуйн түүхий эдийн худалдаа, МАА-н үйлдвэрлэл, ",1,"Пунцаг.Ганболд, ",Пунцаг.Ганболд,2008.03.19,"Пунцаг.Ганболд, ",2020-10-26
5512972,Шунхлайпетролиум,"Улаанбаатар, Хан-Уул, 2-р хороо, 3-р давхар",2011.09.14,"Шатхууны худалдаа, Шатхуун тээвэрлэлт, Төлбөр эсвэл гэрээний үндсэн дээр хийгдэх бөөний худалдаа, ",1,".Шунхлай Холдинг, ",Жагдагдагва.Мөнхнаран,2018.07.02,"Пүрэв.Батсайхан, ",2020-12-23
3504042,Эко энержи ресурс,"Улаанбаатар, Сүхбаатар, 1-р хороо, ЭӨЧ, UBH төвийн 706 тоот",2017.01.31,"Сэргээгдэх эрчим хүчний тоног төхөөрөмжийн угсралт, худалдаа / - /, ",2,"Базар.Батоюун, Сандуйжав.Пүрэвгарьд, ",Базар.Батоюун,2019.05.02,"Сандуйжав.Пүрэвгарьд, Базар.Батоюун, ",2022-03-15
