Регистр,Нэр,Хаяг,Бүртгэсэн_огноо,Үйл_ажиллагааны_чиглэл,Хувьцаа_эзэмшигчийн_тоо,Хувьцаа_эзэмшигч_гишүүд,Итгэмжлэлгүйгээр_төлөөлөх_албан_тушаалтан,ИТАТ_бүртгэсэн_огноо,Эцсийн_Өмчлөгч,ЭӨ_бүртгэсэн_огноо
6203566,ЭМ скай,"Улаанбаатар, Баянзүрх, 26-р хороо, баянмонгол, 416, 224 тоот",2017.07.18,"Хүнсний дэлгүүр, Аялал жуулчлал, Ресторан 1-р зэрэглэл /2020.06.04-2022.06.04/, Хоол үйлдвэрлэл, ",1,"Оргодол.Мөнгөнцэцэг, ",Оргодол.Мөнгөнцэцэг,2018.06.20,"Оргодол.Мөнгөнцэцэг, ",2021-10-15
3622584,Ихнутгийн хаяа,"Өмнөговь, Даланзадгад, 2-р баг, Хан-Уул, хан уул 1, 22 тоот",2013.06.24,"Мах, ногооны худалдаа, ",2,"Хишгээ.Эрдэнэдалай, Давааням.Отгонбаатар, ",Хишгээ.Эрдэнэдалай,2013.06.24,"Хишгээ.Эрдэнэдалай, Давааням.Отгонбаатар, ",2020-12-31
6993664,ТИБ ХИБ,"Улаанбаатар, Чингэлтэй, 5-р хороо, 6 хороолол, 6, 14 тоот",2023.02.13,"Барьцаалан зээлдүүлэх үйлчилгээ, Хүнсний бөөний болон жижиглэнгийн бөөний худалдаа, Барилгын засвар хийх, Бууз, баншны худалдаа, Талх, нарийн боовний худалдаа, Барилгын материалынн худалдаа, Хүнсний бүтээгдэхүүн худалдаа, ",2,"Дашлхүмбэ.Гантөгс, Амарсанаа.Тамир, ",Дашлхүмбэ.Гантөгс,2023.02.13,"Амарсанаа.Тамир, Дашлхүмбэ.Гантөгс, ",2023-02-13
6165265,Вест бюлдинг,"Улаанбаатар, Сүхбаатар, 11-р хороо, рашаан 17, 57 тоот",2017.03.28,"Барилгын засвар хийх, Хүнсний дэлгүүр, ",1,"Нормоожав.Оюунтуяа, ",Нормоожав.Оюунтуяа,2017.03.28,"Нормоожав.Оюунтуяа, ",2020-10-12
4200829,Хайрхан тун,"Хэнтий, Хэрлэн, 3-р баг, Баянмөнх, к 27, 20 тоот",2020.05.29,"Гадаад худалдааны зуучлал, Онлайн худалдаа, Гоо сайхны барааны худалдаа, Хүнсний бөөний болон жижиглэн худалдаа, ",1,"Гунгаа.Баяржаргал, ",Чулуунбаатар.Түмэнжаргал,2020.05.29,"Гунгаа.Баяржаргал, ",2020-05-29
3616452,Эрдэнийн гүн групп,"Өмнөговь, Даланзадгад, 3-р баг, Далан, 12 орон сууцны урд талд Эрдэнийн гүн төв",2011.02.28,"Хуурай замын ачаа тээвэрлэх үйлчилгээ, Ноос, ноолуур угаах, самнах үйл ажиллагаа, Зоогийн газар, гуанз, цайны газрын үйлчилгээ / - /, ",1,"Агваан.Батхишиг, ",Агваан.Батхишиг,2011.02.28,"Агваан.Батхишиг, ",2020-05-14
5388929,Би Би Си Эм,"Улаанбаатар, Баянгол, 12-р хороо, 10",2010.06.24,"Барилгын материалын худалдаа, Бизнесийн зөвлөгөө өгөх, Хувцасны загвар зохион бүтээх, Гадаад худалдаа, ",1,"Цэрэнсоном.Лхагвадулам, ",Цэрэнсоном.Лхагвадулам,2011.01.26,"Цэрэнсоном.Лхагвадулам, ",2020-12-31
6074421,Юу Би макс,"Улаанбаатар, Сүхбаатар, 16-р хороо, бэлхийн 28, 578 тоот",2016.05.09,"Аялал жуулчлал, Хэвлэлийн үйлдвэрлэл, Гадаад худалдаа, ",1,"Сүхбаатар.Мөнхзаяа, ",Сүхбаатар.Мөнхзаяа,2018.10.23,"Сүхбаатар.Мөнхзаяа, ",2020-12-31
5469929,Номинтав трейд,"Улаанбаатар, Хан-Уул, 2-р хороо, чингисийн өргөн чөлөө, Номин Юнайтед цогцолборын 7 давхар",2011.04.18,"Төлбөр эсвэл гэрээний үндсэн дээр хийгдэх бөөний худалдаа, Хүнс, барааны бөөний худалдаа, Харуул хамгаалалтын үйл ажиллагаа, Хүнсний болон барааны худалдаа, Барьцаалан зээлдүүлэх үйлчилгээ, ",2,".Номинхолдинг, Шагдарсүрэн.Баярсайхан, ",Сандбазар.Одонтуяа,2022.12.08,"Номинтав трейд.Номин супермаркет, Номинтав трейд.Номин их дэлгүүр, Номинтав трейд.Номинтав трейд, ",5469929
3000095,Сарлагтолгой,"Архангай, Өгийнуур, 1-р баг, Тоглох, 0",2005.10.22,"Сүү, сүүн бүтээгдэхүүн үйлдвэрлэл, Хуурай замаар хийгдэх ачаа тээвэр, Худалдаа үйлчилгээ, Барилгын материалын худалдаа, ",1,"Ёндон.Дэлгэрмаа, ",Петр.Ариунболд,2015.05.11,"Петр.Ариунболд, ",2020-02-14
3550575,Пүүлэг,"Өвөрхангай, Баян-Өндөр, 5-р баг, Бумбат, Зүүн хаалга",2006.10.25,"Цайны газрын үйлчилгээ / - /, Хүнсний худалдаа, дэлгүүр, ",1,"Махвал.Ариунбаяр, ",Махвал.Ариунбаяр,2006.10.25,"Махвал.Ариунбаяр, ",2022-10-10
5608929,Тэрэмтүшээт,"Улаанбаатар, Чингэлтэй, 16-р хороо, 385 тоот",2012.06.11,"Урлаг соёлын арга хэмжээ зохион байгуулах, Баримтат кино хийх, Зар сурталчилгаа, Дуу дүрс бичлэгийн үйлчилгээ, ",2,"Мөнхбат.Лхагваа, Чимэдрэгзэн.Жавхлантөгс, ",Чимэдрэгзэн.Жавхлантөгс,2012.06.11,"Чимэдрэгзэн.Жавхлантөгс, ",2020-10-13
5369347,Глобалвишн,"Улаанбаатар, Сонгинохайрхан, 22-р хороо, хилчин 27, 8 тоот",2010.04.08,"Онлайн худалдаа, Барилгын засвар хийх, Интерьер, экстерьер дизайн хийх, Программ хангамжийн үйл ажиллагаа, Газар тариалан, Вэб сайтын үйлчилгээ, Төлбөр эсвэл гэрээний үндсэн дээр хийгдэх бөөний худалдаа, Төсөл хөтөлбөр хэрэгжүүлэх, Хүнсний бүтээгдэхүүний бөөний болон жижиглэн худалдаа, Мэдээлэл технологийн үйл ажиллагаа, Уул уурхайн чиглэлээр зөвлөгөө өгөх, ",1,"Мөнхнасан.Энход, ",Мөнхнасан.Энход,2010.04.08,"Мөнхнасан.Энход, ",2020-10-08
6141714,Монсол воль,"Улаанбаатар, Сүхбаатар, 13-р хороо, рашаан 8, 517 тоот",2017.01.18,"Хэвлэх үйлдвэр, Төсөл хөтөлбөр хэрэгжүүлэх, Дуу дүрс бичлэг хийх үйлчилгээ, Аялал жуулчлал, Цайны газар, Төлбөр эсвэл гэрээний үндсэн дээр хийгдэх бөөний худалдаа, ",1,"Жанцан.Батхүү, ",Жанцан.Батхүү,2017.01.18,"Жанцан.Батхүү, ",2021-01-10
6886353,Кайнд соул,"Улаанбаатар, Баянгол, 2-р хороо, энхтайваны өргөн чөлөө, 65/2, 13 тоот",2022.06.27,"Хэвлэх үйл ажиллагаа, Онлайн худалдаа, Төлбөр эсвэл гэрээний үндсэн дээр хийгдэх бөөний худалдаа, ",1,"Сүрэнжав.Энхээ, ",Баянбулаг.Отгонцэцэг,2022.06.27,"Сүрэнжав.Энхээ, ",2022-06-27
4127331,Кибержаал,"Хөвсгөл, Мөрөн, 8-р баг, 13-р байр 2-р орц 14 тоот",2011.05.11,"Авто машины худалдаа, Авто машины сэлбэг эд ангийн худалдаа, Хүнс, ундаа, тамхи голлосон төрөлжсөн бус барааны дэлгүүр, Барьцаалан зээлдүүлэх үйлчилгээ, Гэр ахуйн цахилгаан барааны худалдаа, Дохиолол хамгаалалтын системээр хангах, Спортын тоног төхөөрөмж, багаж хэрэгслийн худалдаа, Лавлагаа, хаягийн жагсаалтын эх бэлтгэх, нийтлэх үйл ажиллагаа, Харилцаа холбооны  тоног төхөөрөмжийн  төрөлжсөн дэлгүүрийн жижиглэн худалдаа, Гадаад худалдаа, Албан ажлын болон тооцоолох машины засвар үйлчилгээ, Электрон тоног төхөөрөмж, тэдгээрийн сэлбэг хэрэгслийн бөөний худалдаа,засвар, Компьютер, түүний дагалдах тоног төхөөрөмж, программ хангамжийн худалдаа, ",1,"Шаравдорж.Дарьжав, ",Шаравдорж.Дарьжав,2016.09.08,"Шаравдорж.Дарьжав, ",2020-12-25
5910773,Хаадын гэр,"Улаанбаатар, Баянзүрх, 19-р хороо,  Их могол  ХХК-ийн байр",2014.12.08,"Керамик үйлдвэрлэл, Монгол гэр, гэрийн тавилга хийх, Ширмэл ширдэг, эсгий эдлэл хийх, Гадаад худалдаа, ",1,"Дамдиндорж.Болорэрдэнэ, ",Дамдиндорж.Болорэрдэнэ,2018.05.21,"Дамдиндорж.Болорэрдэнэ, ",2020-12-24
4025482,НГН баялаг,"Увс, Улаангом, 3-р баг, галдан бошигт хороолол, 323, байр 06 тоот",2022.04.15,"Хүнсний бөөний худалдаа, ",1,"Бямбажав.Лхамаа, ",Бямбажав.Лхамаа,2022.04.15,"Бямбажав.Лхамаа, ",2022-04-15
6056334,Визард анимэйшн,"Улаанбаатар, Хан-Уул, 15-р хороо, туул гол, 56б, 35 тоот",2016.03.17,"Зар сурталчилгаа хийх, Хүнсний нэмэлт бүтээгдэхүүний үйлдвэрлэл, худалдаа, Гадаад худалдаа, Авто машинаар ачаа тээвэрлэх, Аялал жуулчлал, ",1,"Батэрдэнэ.Өлзийучрал, ",Батэрдэнэ.Өлзийучрал,2016.03.17,,
2161125,Мундрага,"Хөвсгөл, Ханх, 3-р баг, Турт, 0",2006.03.22,"Мал эмнэлгийн үйлчилгээ /2006.03.26 - /, ",2,"Банзрагч.Баясгалан, Бавуудорж.Нямцэцэг, ",Банзрагч.Баясгалан,2006.03.22,"Банзрагч.Баясгалан, ",2020-12-15
6870155,Спорт продакшн,"Улаанбаатар, Баянгол, 18-р хороо, 4 хороолол, жалханц хутагт дамдинбазар, 72а, 35 тоот",2022.05.19,"Урлаг соёлын арга хэмжээ зохион байгуулах, Программ хангамжийн үйл ажиллагаа, Дуу дүрс бичлэг хийх, Мэдээлэл технологийн үйл ажиллагаа, Төлбөр эсвэл гэрээний үндсэн дээр хийгдэх бөөний худалдаа, ",1,"Дэмчиг.Лхагваочир, ",Дэмчиг.Лхагваочир,2022.05.19,"Дэмчиг.Лхагваочир, ",2022-05-19
5752507,Жигүүркатеринг,"Улаанбаатар, Чингэлтэй, 19-р хороо, доод салхитын 8, 132 тоот",2013.09.26,"Газар тариалан, Хүнсний бөөний худалдаа, Гадаад худалдаа, Барилгын материалын худалдаа, Уул уурхайн тоног төхөөрөмжийн худалдаа, ",1,"Гансүх.Уянга, ",Гансүх.Уянга,2013.09.26,"Гансүх.Уянга, ",2020-11-09
6001912,Анура фарм,"Улаанбаатар, Баянзүрх, 4-р хороо, 15-р хороолол, 10, 3 тоот",2015.09.10,"Гадаад худалдаа, ",2,"Жаргалсайхан.Анхбаяр, Жаргалсайхан.Баярмаа, ",Жаргалсайхан.Анхбаяр,2016.10.28,"Жаргалсайхан.Баярмаа, Жаргалсайхан.Анхбаяр, ",2022-05-25
3567419,Хутагт уулын өгөөж,"Өвөрхангай, Бат-Өлзий, 4-р баг, Зөрүүлэг, 0",2020.08.06,"Аялал жуулчлал, Малын эмийн сан, Мал эмнэлгийн үйл ажиллагаа, ",2,"Пүрэвсүрэн.Бундхорол, Пүрэвтогтох.Содномбалжир, ",Пүрэвтогтох.Содномбалжир,2020.08.06,"Пүрэвтогтох.Содномбалжир, Пүрэвсүрэн.Бундхорол, ",2020-08-06
6072119,Гурван мөнх констракшн,"Улаанбаатар, Баянзүрх, 25-р хороо, ногоон төгөл, 170б, 71 тоот",2016.05.02,"Уул уурхайн тоног төхөөрөмжийн худалдаа, Фермерийн аж ахуй, Мах, махан бүтээгдэхүүний үйлдвэрлэл, худалдаа, Гадаад худалдаа, Барилгын засвар хийх, Газар тариалан, ",1,"Ганхуяг.Мөнхчимэг, ",Ганхуяг.Мөнхчимэг,2016.05.02,"Ганхуяг.Мөнхчимэг, ",2020-10-18
5501717,Хайгрэйд,"Улаанбаатар, Баянгол, 6-р хороо, 35 тоот",2011.08.04,"Компьютерийн засвар үйлчилгээ, Гадаад худалдаа, Бэлэн мөнгөний машины тоног төхөөрөмжийн худалдаа, Эм барих, Программ хангамжийн үйл ажиллагаа, ",1,"Төмөрсүх.Үүрийнцолмон, ",Төмөрсүх.Үүрийнцолмон,2011.08.04,"Төмөрсүх.Үүрийнцолмон, ",2020-09-16
6065376,Нандир,"Улаанбаатар, Баянгол, 13-р хороо, 2д, 92 тоот",2016.04.12,"Барилгын засвар хийх, Барилгын материалын худалдаа, Мод модон эдлэлийн үйлдвэрлэл, худалдаа, Хэвлэлийн эх бэлтгэх, Оёдол эсгүүр, оёдлын үйлдвэрлэл, Хаяг реклам хийх, Хэвлэх үйлдвэрлэл, Төсөл хөтөлбөр хэрэгжүүлэх, Урлаг соёлын арга хэмжээ зохион байгуулах, Кофе шоп, Бизнесийн зөвлөгөө өгөх, Аялал жуулчлал, Худалдааны зуучлал, Хүнд машин механизмын тоног төхөөрөмжийн худалдаа, Уран сайхны болон гэрэл зургийн үйлчилгээ, ",1,"Цэрэнпунцаг.Цэрэндаш, ",Цэрэнпунцаг.Цэрэндаш,2016.04.12,"Цэрэнпунцаг.Цэрэндаш, ",2020-08-28
4011953,Сансаржим,"Увс, Улаангом, 11-р баг, ",2013.08.15,"Гоо сайхны бүтээгдэхүүний борлуулалт / - /, Үсчин, гоо сайхны үйлчилгээ, Гэр ахуйн модон эдлэлийн борлуулалт, нийлүүлэлт, Үхрийн нүд, чацаргана, хүнсний ногооны борлуулалт, нийлүүлэлт, Сүү, сүүн бүтээгдэхүүний үйлдвэрлэл, борлуулалт, Мах, махан бүтээгдэхүүний үйлдвэрлэл болон борлуулалт, Арьс, ширэн бүтээгдэхүүний үйлдвэрлэл, борлуулалт, Гэр ахуйн модон эдлэлийн үйлдвэрлэл, ",10,"Ноост.Отгонгарав, Бадарч.Батбаяр, Гомбо.Цэцэгмаа, Цэвээн.Ноост, Ноост.Солонго, Төгсжаргал.Наранцэцэг, Ноост.Аръяабал, Бадарч.Батбаатар, Ноост.Цэнжаргал, Ноост.Баяндалай, ",Бадарч.Батбаяр,2016.11.24,"Бадарч.Батбаяр, ",2022-07-15
6889654,Хүслэн аарт тийм,"Улаанбаатар, Сүхбаатар, 15-р хороо, дамбадаржаа 16, 144а тоот",2022.07.05,"Төмрөөр хашаа, хайс, хаалт хийх, Хэвлэлийн үйлдвэр, Хаяг реклам, зар сурталчилгаа хийх, Барилгын засвар хийх, Хэвлэлийн эх бэлтгэл, Төлбөр эсвэл гэрээний үндсэн дээр хийгдэх бөөний худалдаа, ",1,"Буяндэлгэр.Мөнгөнтулга, ",Буяндэлгэр.Мөнгөнтулга,2022.07.05,"Буяндэлгэр.Мөнгөнтулга, ",2022-07-05
5302323,Номин-Ендэрт,"Улаанбаатар, Баянгол, 1-р хороо, 2 хороолол, замчид, 39-байр, 304 тоот ",2009.05.06,"Барилгын засвар, засал чимэглэл, Эрчим хүчний тоног төхөөрөмжийн худалдаа, Эрчим хүч угсралт 03.2.1 /2011.05.25-2014.05.25/ /2011.05.25 - 2014.05.25/, ",1,"Цэндсүрэн.Адъяа, ",Цэндсүрэн.Адъяа,2009.05.06,"Цэндсүрэн.Адъяа, ",2020-10-06
6069657,Уран шивээ,"Улаанбаатар, Баянзүрх, 23-р хороо, 2а хэсэг баатархайрхан, 754 тоот",2016.04.22,"Гадаад худалдаа, Аялал, жуулчлал, Хүлэмжийн аж ахуй, Автомашины засвар, үйлчилгээ, Оёдлын үйлдвэрлэл, худалдаа, ",1,"Буянсүрэн.Цэрэнбаатар, ",Буянсүрэн.Цэрэнбаатар,2016.04.22,"Буянсүрэн.Цэрэнбаатар, ",2020-12-22
3510921,Уулсын уран итгэлт,"Завхан, Их-Уул, 2-р баг, Үржил, Хөдөө",2022.02.11,"Эм, гоо сайханы барааны худалдаа /2022.03.18-2023.04.09/, ",1,"Данаасүрэн.Дагийдулам, ",Данаасүрэн.Дагийдулам,2022.02.11,"Данаасүрэн.Дагийдулам, ",2022-02-11
9087702,Монгол-Улсын боловсролын их сургууль,"Улаанбаатар, Сүхбаатар, 8-р хороо, бага тойруу, МУБИС-ийн хичээлийн А байр",2006.01.06,"Байгаль,нийгэм,хүмүүнлэгийн ухааны бакалавр, магистр, докторын зэрэгтэй багш, мэргэжилтэн бэлтгэх сургалт /2015.06.03-2019.06.03/ /2019.06.13 - 2024.06.13/, ",1,,Жамъянсүрэн.Батбаатар,2023.03.27,"Дашдорж.Мандах, ",2020-10-14
8261695,Соёмбо уран бүтээлийн нэгдэл,"Улаанбаатар, Баянгол, 18-р хороо, 4 хороолол, 47а-39",2017.11.21,"Соёл, урлагийн арга хэмжээ зохион байгуулах зорилгоор сургалт, семинар,  төсөл, хөтөлбөр хэрэгжүүлэх, уулзалт зохион байгуулах, төрийн болон төрийн бус байгууллагуудтай хамтран ажиллах, ",1,"Сүрэнхорлоо.Нэргүй, ",Сүрэнхорлоо.Нэргүй,2017.11.21,"Сүрэнхорлоо.Нэргүй, ",2020-10-20
4407687,Шимийн шимт,"Орхон, Баян-Өндөр, 5-р баг, Уртбулаг, 5 хороолол, 23, 63 тоот",2018.01.11,"Барилгын материалын худалдаа, Хүнсний  худалдаа, Барилгын засал чимэглэл, Санхүүгийн зөвлөгөө үйлчилгээ, ",1,"Ганбаатар.Болортуяа, ",Ганбаатар.Болортуяа,2018.01.11,"Ганбаатар.Болортуяа, ",2023-03-13
5832438,Эхлэл шинэчлэлт прожект,"Улаанбаатар, Баянгол, 6-р хороо, 10-р хороолол, энхтайваны өргөн чөлөө, 24, 16 тоот",2014.04.18,"Барилгын засвар, Төлбөр эсвэл гэрээний үндсэн дээр хийгдэх бөөний худалдаа, ",1,"Цэрэнбаатар.Батдэлгэр, ",Цэрэнбаатар.Хашбат,2018.06.18,"Цэрэнбаатар.Батдэлгэр, ",2022-04-11
6630243,Смарт Эй Би Си,"Улаанбаатар, Баянзүрх, 28-р хороо, хужирбулан 5, 86-2669 тоот",2020.10.13,"Төлбөр эсвэл гэрээний үндсэн дээр хийгдэх бөөний худалдаа, Гэр ахуйн барааны худалдаа, Тоног төхөөрөмжийн худалдаа, Хэвлэх үйлдвэр, Хэвлэх үйлдвэрийн тоног төхөөрөмжийн худалдаа, засвар, Хэвлэлийн эх бэлтгэх, Барилгын болон сангийн материалын бөөний, жижиглэнгийн худалдаа, Зар сурталчилгаа хийх, Барилгын засварын үйл ажиллагаа, ",3,"Даваацэрэн.Нарангарав, Сунгарав.Баттүшиг, Жумдай.Сунгарав, ",Сунгарав.Баттүшиг,2020.10.13,"Сунгарав.Баттүшиг, ",2020-10-13
8043612,Дэлхийн монгол туургатны өв соёлыг хамтран хамгаалах их голомт сан,"Улаанбаатар, Баянгол, 13-р хороо, 57 тоот",2011.02.02,"Монгол туургатны өв соёл, ардын уламжлалт урлаг, зан үйлийг олон улсад таниулан сурталчлах, ",1,"Гэндэнпил.Явгаан, ",Гэндэнпил.Явгаан,2011.02.02,,
3652033,Сагсан бөмбөг тэмүүлэл,"Өмнөговь, Даланзадгад, 6-р баг, Их уул, их уул 20, 7 тоот",2023.01.26,"Өмнөговь аймгийн сагсан бөмбөг сонирхогч хүүхэд залуучуудын ур чадварыг хөгжүүлэх, мэргэжлийн түвшний тамирчдыг бэлтгэн гаргахад дэмжлэг үзүүлэх, ",3,,Бэхбат.Өлзийбат,2023.01.26,"Бэхбат.Өлзийбат, ",2023-01-26
6347002,Вигэн медикал,"Улаанбаатар, Баянгол, 10-р хороо, зүүн наран 14, 86 тоот",2018.09.12,"Гадаад худалдаа, ",1,"Kim.Ssangmi, ",Jeong.Philyoung,2022.05.23,"Kim.Ssang, ",2020-08-25
8198357,Вип эксперт сэтгүүл,"Улаанбаатар, Хан-Уул, 2-р хороо, үйлдвэр, 86, 101 тоот",2016.01.15,"Нийгмийн салбарт тулгамдаж буй асуудлууд, мэдээ мэдээллийг нийтлэх, ",1,"Баасансүрэн.Уугантуяа, ",Баасансүрэн.Уугантуяа,2020.09.04,"Баасансүрэн.Уугантуяа, ",2020-09-04
4406338,МСДОС трейд,"Орхон, Баян-Өндөр, 7-р баг, Дэнж, зүүн дэнж 2, 2  тоот",2017.05.23,"Хөдөлмөр хамгааллын хэрэгслийн худалдаа, Хяналтын камерын худалдаа, угсралт, суурьлуулалт, Хүнс бөөний  худалдаа, Гадаад худалдаа, Компьютерийн засвар, үйлчилгээ, Мах, махан бүтээгдэхүүний үйлдвэрлэл, худалдаа, Барилгын засвар үйлчилгээ, засал чимэглэл, Хүнс, жимс, жимсгэний  жижиглэн худалдаа, ",1,"Дамдинсүрэн.Оюунжаргал, ",Дамдинсүрэн.Оюунжаргал,2017.05.23,"Дамдинсүрэн.Оюунжаргал, ",2020-12-10
8091196,Аж үйлдвэрийн паркийн технологи дамжуулах төв,"Улаанбаатар, Чингэлтэй, 6-р хороо, бага тойруу,  Монинжбар  ХК-ийн байр,201тоот",2012.11.20,"Үйлдвэр технологийн паркуудтай техник, технологийн чиглэлээр хамтран ажиллах, дэмжлэг үзүүлэх, судалгаа хийх, төсөл хөтөлбөр хэрэгжүүлэх, ",5,"Батбаяр.Артагбат, Жаргалмаа.Гэрэлмаа, Батбаяр.Баяршанд, Довчин.Баярсайхан, Оюунжаргал.Нямсүрэн, ",Довчин.Баярсайхан,2020.09.30,"Батбаяр.Артагбат, ",2020-09-30
3071553,Бек-Импекс,"Баян-Өлгий, Өлгий, 5-р баг, Ховд гол, 2/60, 15",2015.02.25,"Төлбөр эсвэл гэрээний үндсэн дээр хийгдэх бөөний худалдаа, Барилгыг дуусгах шатны ажил, ",1,"Өмирзах.Дауренбек, ",Өмирзах.Дауренбек,2021.09.01,"Өмирзах.Дауренбек, ",2021-09-01
