Регистр,Нэр,Хаяг,Бүртгэсэн_огноо,Үйл_ажиллагааны_чиглэл,Хувьцаа_эзэмшигчийн_тоо,Хувьцаа_эзэмшигч_гишүүд,Итгэмжлэлгүйгээр_төлөөлөх_албан_тушаалтан,ИТАТ_бүртгэсэн_огноо,Эцсийн_Өмчлөгч,ЭӨ_бүртгэсэн_огноо
2306832,ТОНЭ өрхийн эрүүл мэндийн төв,"Улаанбаатар, Сонгинохайрхан, 1-р хороо, толгойт 73, 27 тоот",2008.07.25,"Өрхийн эмнэлгийн үйл ажиллагаа /2018.04.17 - 2028.04.17/, ",6,"Ногояа.Элбэгзаяа, Дамдинжамц.Баасансүрэн, Чимэдцэен.Сарантуяа, Болд.Туяа, Ханджав.Энхсайхан, Балганжав.Отгончулуун, ",Ханджав.Энхсайхан,2011.05.09,"Ханджав.Энхсайхан, ",2020-10-15
5118549,ЕТЕМО,"Улаанбаатар, Баянзүрх, 18-р хороо, 13 хороолол, 29-2 давхар",2007.02.15,"Эмэгтэйчүүдийн үзлэг, оношилгоо, эмчилгээ, цитологи, гистологи шинжилгээ, чих хамар хоолой, толгой хүзүү, хавдар судлал, мэс засал, мэс ажилбар /хугацаа 2016.05.29-2019.05.29/ /2019.05.29 - 2024.05.29/, Гадаад худалдаа, Аялал жуулчлал, Эмнэлгийн багаж, тоног төхөөрөмж, дагалдах хэрэгсэл, оношлуур ханган нийлүүлэх, импортлох, худалдах /хугацаа 2016.12.16-2021.12.16/, ",1,"Цэнд.Энхболд, ",Шархүү.Энхтуяа,2022.02.15,"Цэнд.Энхболд, ",2022-02-15
8146454,Дархан-Уул аймгийн ахмадын хороо,"Дархан-Уул, Дархан, 16-р баг, 1 хороолол, Ахмадын хорооны байр",2014.07.29,"Нийт ахмад настнуудыг нийгмийн халамж болон нийгмийн хамгаалалтын хуульд нийцүүлэн эрх ашгийг нь хамгаалах, оролцуулахад чиглэнэ., ",1,"Данзан.Энхтайван, ",Дамдиндорж.Цэрэндаваа,2021.03.19,"Магсаржав.Дэмбэрэлмаа, ",2020-10-14
2583879,Далд-Увидас,"Улаанбаатар, Сонгинохайрхан, 18-р хороо, үэ 35, 00",2007.04.23,"Төлбөр эсвэл гэрээний үндсэн дээр хийгдэх бөөний худалдаа, Фермер, газар тариалан эрхлэх, Уламжлалт, дотрын өвчний оношилгоо, эмчилгээ /2018.12.26 - 2023.12.26/, Амралтын газар, Мэдрэлийн өвчний тусламж, үйлчилгээ /2012.02.20 - 2023.12.26/, ",1,"Намнанжав.Эрдэнэтуяа, ",Намнанжав.Эрдэнэтуяа,2007.04.23,"Намнанжав.Эрдэнэтуяа, ",2020-10-15
4084403,Монос ховд,"Ховд, Жаргалант, 7-р баг, Магсаржав, 1/60, 01 тоот",2018.07.27,"Эм, эмнэлэгийн хэрэгсэл, оношлуур урвалж, тоног төхөөрөмжийн бөөний худалдаа /2018.09.12 - 2025.03.12/, Эмийн сан, Гадаад худалдаа, ",1,"Лувсан.Хүрэлбаатар, ",Даваа.Улаанхүү,2018.07.27,"Лувсан.Хүрэлбаатар, ",2020-12-15
6817092,Зол интернэйшнл медиа,"Улаанбаатар, Баянзүрх, 25-р хороо, нарны зам, 84 тоот",2022.02.07,"Гоо сайхан, ариун цэврийн барааны худалдаа, Үсчин, гоо сайхны үйлчилгээ, Урлаг соёлын арга хэмжээ зохион байгуулах, Цахилгаан барааны засвар, үйлчилгээ, Дуудлагын жолоочийн үйлчилгээ, Төсөл хөтөлбөр хэрэгжүүлэх, Аялал, жуулчлал, Үзэсгэлэн яармаг зохион байгуулах, Гар урлалын бүтээгдэхүүний худалдаа, Компьютерын тоног төхөөрөмжийн худалдаа, Электрон болон холбооны тоног төхөөрөмж, тэдгээрийн сэлбэг хэрэгслийн худалдаа, Уул уурхай, эрчим хүчний тоног төхөөрөмжийн засвар үйлчилгээ, Түргэн хоолны үйлчилгээ, ",1,"Алтанцэцэг.Батөлзий, ",Алтанцэцэг.Батөлзий,2022.02.07,"Алтанцэцэг.Батөлзий, ",2022-02-07
4083067,Тээлийн илч ,"Ховд, Зэрэг, 5-р баг, Хөндлөн, ",2017.10.16,"Дулаан үйлдвэрлэх, түгээх, эрчим хүчээр зохицуулалттай хангах / - /, ",1,".Ховд Аймгийн Зэрэг Сумын Иргэдийн Төлөөлөгчдийн Хурал, ",Дамдин.Нямочир,2017.10.16,"Дамдин.Нямочир, ",2020-02-05
3126471,Гэгээн-Их,"Баянхонгор, Баянхонгор, 4-р баг, Угалз, 4 тоот",2012.04.17,"Барилгыг дуусгах шатны ажил, Кафе, гуанз, зоогийн газрын үйлчилгээ, Аялал, жуулчлалын үйл ажиллагаа, Ачаа, тээш ачих, буулгах үйлчилгээ, Амралтын газрын үйлчилгээ, Хүнсний барааны бөөний  худалдаа, Мах махан бүтээгдэхүүн үйлдвэрлэл, Дэлгүүрээр дамждаггүй бусад жижиглэн худалдаа, ",1,"Очирбат.Ганэрдэнэ, ",Очирбат.Ганэрдэнэ,2012.04.17,"Очирбат.Ганэрдэнэ, ",2020-08-21
5649242,Монэнзиммед,"Улаанбаатар, Хан-Уул, 3-р хороо, Эв нэгдлийн гудамж Монэнзим ХХК-ийн өргөтгөл",2012.11.09,"Гадаад худалдаа, ",1,"Бэгз.Одгэрэл, ",Батмагнай.Батсуурь,2022.09.28,"Бэгз.Одгэрэл, ",2020-03-05
2831457,Тунамалмед,"Улаанбаатар, Баянзүрх, 13-р хороо, энх тайваны өргөн чөлөө, 127/5, 32 тоот",2006.08.30,"Эм,эмнэлгийн хэрэгсэл, биологийн идэвхит бүтээгдэхүүн ханган нийлүүлэх, импортлох, худалдах /2017.09.16-2022.09.16/ хүртэл /2013.06.19 - 2014.09.19/, Гадаад худалдаа, ",1,"Базаргүр.Пүрэвдулам, ",Базаргүр.Пүрэвдулам,2014.01.27,"Базаргүр.Пүрэвдулам, ",2020-10-19
5129222,Электронтехник,"Улаанбаатар, Баянгол, 5-р хороо, 10-р хороолол, энхтайваны өргөн чөлөө, SHOWTEC",2007.04.09,"Аялал, жуулчлал, Гадаад худалдаа, Хөгжим гэрэлтүүлгийн тоног төхөөрөмжийн сэлбэгийн худалдаа, засвар, ",1,"Чимэдрэгзэн.Баярхүү, ",Чимэдрэгзэн.Баярхүү,2007.04.09,"Чимэдрэгзэн.Баярхүү, ",2020-10-14
5316278,Викиворлд,"Улаанбаатар, Баянгол, 19-р хороо, 31",2009.07.21,"Программ хангамжийн үйл ажиллагаа, Интернэтийн үйлчилгээ, Гадаад худалдаа, Худалдааны зуучлал, ",1,"Төрмөнх.Хатантөмөр, ",Төрмөнх.Хатантөмөр,2009.07.21,"Төрмөнх.Хатантөмөр, ",2020-09-24
2584573,Номун-Интертрейд,"Улаанбаатар, Хан-Уул, 3-р хороо, үйлдвэр, 1, Үйлдвэрийн гудамж-25 тоот",2006.10.20,"Төлбөр эсвэл гэрээний үндсэн дээр хийгдэх бөөний худалдаа, Хүнсний агуулахын үйл ажиллагаа, Менежментийн зөвлөгөө өгөх үйл ажиллагаа, ",2,"Содном.Болорсайхан, Жаргалсайхан.Номуундарь, ",Содном.Болорсайхан,2017.03.24,"Жаргалсайхан.Номуундарь, Содном.Болорсайхан, ",2021-10-28
5816122,Голден яард трейд,"Улаанбаатар, Сүхбаатар, 7-р хороо, 11 хороолол, эрхүүгийн, 8, 142 тоот",2014.03.16,"Мал аж ахуй эрхлэх, Сүү, сүүн бүтээгдэхүүний үйлдвэрлэл, худалдаа, Мах, махан бүтээгдэхүүний үйлдвэрлэл, худалдаа, Хүнсний бөөний  худалдаа, Гадаад худалдаа, ",1,"Лхагвадорж.Даваадорж, ",Лхагвадорж.Даваадорж,2019.09.23,"Лхагвадорж.Даваадорж, ",2020-10-10
2059312,Орхондалай,"Сэлэнгэ, Орхон, 1-р баг, Орхон, 1",2006.04.12,"Гадаад дотоод худалдаа, Мал аж ахуй, Үр тарианы гурил үйлдвэрлэл, Газар тариалан, ",5,"Сод.Бүрэнбат, Анаамиш.Баторхон, Батхүү.Баярхүү, Өлзийбаяр.Батсайхан, Цэнд.Дашжанчив, ",Бүрэнбат.Нямбаяр,2013.03.18,,
3379035,Стандард рэзидэнс констракшн,"Дорнод, Хэрлэн, 11-р баг, 101, Зоорийн давхар В1",2015.03.13,"Гадаад худалдаа эрхлэх, ",1,"Баярцогт.Энхэрдэнэ, ",Баярцогт.Энхэрдэнэ,2015.03.13,"Баярцогт.Энхэрдэнэ, ",2021-01-15
4611217,Арвис-Интернэшнл,"Улаанбаатар, Баянзүрх, 11-р хороо, товчоо 4, -60 тоот",2006.02.22,"Барилга угсралт 2.1.1, 2.1.2, 2.2.1, 2.2.2 заалтын дагуу /2018.01.25-2023.01.25 хүртэл/ / - /, Барилгын материалын жижиглэн худалдаа, Гадаад худалдаа, ",1,"Ёндон.Пүрэвдаваа, ",Ёндон.Пүрэвдаваа,2018.11.30,"Ёндон.Пүрэвдаваа, ",2020-12-25
4079175,Оргил-Өнөр,"Ховд, Жаргалант, 8-р баг, Наран, 26, 8 тоот",2015.05.07,"Усны барилга байгууламж барих, сэргээн засварлах, шинэчлэх /2020.12.03 - 2025.12.03/, Барилгын засвар, орчны тохижилт хийх, Хүнсний төрөлжсөн дэлгүүрийн жижиглэн худалдаа, Тахианы аж ахуй эрхлэх, Газар тариалан, мал аж ахуй хослон эрхлэх, Барилга угсралт /2019.04.24 - 2024.04.24/, ",3,"Ахыт.Жанбота, Манж.Наранцэцэг, Бөхчулуун.Мөнхтөмөр, ",Манж.Наранцэцэг,2017.08.16,"Бөхчулуун.Мөнхтөмөр, ",2021-04-30
2398125,Завханбуурал,"Завхан, Дөрвөлжин, 1-р баг, Буга, 0",2005.10.05,"Ахуйн үйлчилгээ, Хүнсний барааны жижиглэн болон бөөний худалдаа, Сүү, сүүн бүтээгдэхүүн үйлдвэрлэл, борлуулалт, Мал аж үржлийн үйлчилгээ, хээлтэгч, хээлтүүлэгч, үржүүлэх, Гадаад худалдаа, Оёмол бүтээгдэхүүн үйлдвэрлэлт, борлуулалт, засвар, ХАА-н бүтээгдэхүүний худалдаа, ",9,"Нямсүрэн.Нямбаяр, Нямсүрэн.Ариунаа, Жамц.Отгоолой, Саандар.Мөнхбат, Очирбат.Азбилэг, Цэрэндулам.Ганбаатар, Норхил.Нямсүрэн, Цагаан.Батдорж, Орос.Энэбиш, ",Жамц.Отгоолой,2005.10.05,"Жамц.Отгоолой, Норхил.Нямсүрэн, Нямсүрэн.Ариунаа, ",2020-10-30
2381419,Ханжаргалант ховд,"Ховд, Жаргалант, 6-р баг, Жаргалан, 1",2008.01.17,"Цайны газрын үйлчилгээ / - /, Мах, махан бүтээгдэхүүн үйлдвэрлэлт, ",10,"Шагдаржав.Цэвээн, Эрдэнээ.Өлзийхутаг, Эрдэнэ.Өлзийхүү, Бадамрагчаа.Хатанболд, Дагванамжил.Бадамрагчаа, Бадамрагчаа.Аззаяа, Бадамрагчаа.Нинжбадгар, Тулгаа.Очэрдэнэ, Оюута.Бямбацэрэн, Энхтүвшин.Мөдөг, ",Эрдэнэ.Өлзийхүү,2008.01.17,"Эрдэнэ.Өлзийхүү, Дагванамжил.Бадамрагчаа, ",2021-03-24
3564363,Арвайхээр цэцэрлэгжилт,"Өвөрхангай, Арвайхээр, 5-р баг, Арвайхээр, 7, 102",2018.01.16,"Био ялзмагийн бордооны үйлдвэрлэл, Мод үржүүлэг, үр, тарьц, суулгацын үйлдвэрлэл худалдаа, Байгууллага аж ахуй нэгжийн гадна талбайн тохижилт, ногоон байгууламжийн ажил үйлчилгээ, Хот цэцэрлэгжүүлэлтийн цогц үйлчилгээ, Цэцэрлэгт хүрээлэн, хүүхдийн паркийн ашиглалт хамгаалалт, Хүлэмжийн аж ахуй, ",1,".Өвөрхангай Аймгийн Иргэдийн Төлөөлөгчдийн Хурал, ",Даваадавга.Мягмар,2018.01.16,,
4092201,Алтайн мийт,"Ховд, Жаргалант, 3-р баг, Бичигт, Үйлдвэрийн 8, 813",2021.06.26,"Малын тэжээл үйлдвэрлэл, Хүнсний ногоо тариалалт, Хүнсний бөөний худалдаа, Үхрийн фермерийн аж ахуй, Мах, махан бүтээгдэхүүн үйлдвэрлэл, Хүнсний төрөлжсөн дэлгүүрийн жижиглэн худалдаа, ",2,"Зуноров.Эрхбаяр, Бумнанжид.Түвшинжаргал, ",Зуноров.Эрхбаяр,2021.06.26,"Зуноров.Эрхбаяр, Бумнанжид.Түвшинжаргал, ",2021-07-01
2033763,Баруунмонгол интернэйшнл,"Ховд, Жаргалант, 4-р баг, Бугат, Өөрийн байранд",2006.05.15,"Тээвэр зуучлал, Газар тариалан, мал аж ахуй хослон эрхлэх үйл ажиллагаа, Гадаад, дотоод худалдаа, Баар, кафе ажиллуулах / - /, Махан зоорь, Хүнсний дэлгүүр ажиллуулах, ",1,"Өлзийбаяр.Түвдэндорж, ",Өлзийбаяр.Түвдэндорж,2006.05.15,"Өлзийбаяр.Түвдэндорж, ",2021-12-08
6886329,Рийч твинс,"Улаанбаатар, Баянзүрх, 26-р хороо, баянмонгол, 412, 104 тоот",2022.06.27,"Төлбөр эсвэл гэрээний үндсэн дээр хийгдэх бөөний худалдаа, Хөдөө аж ахуй, Хэвлэлийн үйлдвэрлэл, Хаяг, шошго сав боодлын үйлдвэрлэл, ",1,"Цэцэгмаа.Сарнай, ",Батбаяр.Анхбаатар,2022.12.12,"Цэцэгмаа.Сарнай, ",2022-06-27
6261736,Таван од констракшн,"Улаанбаатар, Чингэлтэй, 6-р хороо, 6-р хороолол, бага тойруу, 62, 25 тоот",2017.12.26,"Аялал жуулчлал, Гадаад худалдаа, Хоёрдогч түүхий эд боловсруулах, Төмрөөр хашаа, хайс, хаалт хийх, Барилгын материалын худалдаа, Барилгын ажил, үйлчилгээ БА-2.1, БА-3.1, БА-8.1 заалтын дагуу, нэмэлтээр БА-3.3, БА-6.1, БА-6.2, БА-6.3, БА-6.4 заалтын дагуу /хугацаа 2018.08.03-2023.08.03/ /2018.08.03 - 2023.08.03/, Газар тариалан, ",1,"Нямдорж.Мөнхдорж, ",Ганбаатар.Мөнхэрдэнэ,2019.07.22,"Нямдорж.Мөнхдорж, ",2022-06-02
2329069,Очгэрэл,"Увс, Улаангом, 5-р баг, 8, 7",2007.02.23,"Барилга угсралтын ажил / - /, Тээврийн үйлчилгээ, Сантехник, цахилгаан засварлах, угсрах, ",2,"Дүгэржав.Лхагвасүрэн, Дүгэржав.Дашдаваа, ",Дүгэржав.Лхагвасүрэн,2013.04.22,"Дүгэржав.Лхагвасүрэн, ",2021-01-10
8159238,Монголын тэшүүрийн холбоо,"Улаанбаатар, Хан-Уул, 15-р хороо, чингисийн өргөн чөлөө, Олимпик хаус-109",2014.12.15,"Тэшүүрийн спортыг хөгжүүлэх, өндөр зэрэглэлтэй баг, тамирчдыг бэлтгэх, дасгалжуулах, уралдан тэмцээн зохион байгуулах, сурталчлах, ",1,"Төмөрбаатар.Нямдаваа, ",Дамдин.Болормаа,2015.12.25,,
6967167,Монжин гүүр,"Улаанбаатар, Хан-Уул, 18-р хороо, хүннү-2222, их монгол улс, 108, 903",2022.12.16,"Төлбөр эсвэл гэрээний үндсэн дээр хийгдэх бөөний худалдаа, Уул уурхайн чиглэлээр зөвлөгөө өгөх, Уул уурхайн тоног төхөөрөмжийн худалдаа, ",2,"Өлзийсайхан.Билэгсайхан, ..Saiwang, ",Өлзийсайхан.Билэгсайхан,2022.12.16,"Өлзийсайхан.Билэгсайхан, ",2022-12-16
6136168,Арвин майнинг,"Улаанбаатар, Сүхбаатар, 5-р хороо, 5 хороолол, 52/б, 20 тоот",2017.01.04,"Гадаад худалдаа, Автомашины сэлбэгийн худалдаа, Автомашины худалдаа, Зар сурталчилгаа хийх, Геологийн тойм судалгаа хийх, Барилгын засвар хийх, Уул уурхайн чиглэлээр зөвлөгөө өгөх, Барилгын материалын худалдаа, Хүнсний бөөний худалдаа, Автомашинаар ачаа тээвэрлэх, ",1,"Батэрдэнэ.Будсүрэн, ",Батэрдэнэ.Будсүрэн,2018.04.26,"Батэрдэнэ.Будсүрэн, ",2020-12-30
6339204,Ижил очир сувд,"Улаанбаатар, Сонгинохайрхан, 17-р хороо, өнөр хороолол, 33, 54 тоот",2018.08.17,"Гадаад худалдаа, Барилгын материалын худалдаа, Хүнсний дэлгүүр, Цайны газар / - /, ",1,"Галдансамбуу.Төмөрочир, ",Галдансамбуу.Төмөрочир,2018.08.17,,
5046815,Зүүнсайн,"Улаанбаатар, Баянзүрх, 12-р хороо, жанжин 21, 407",2006.02.28,"Газар тариалан, Газрын хэвлийн нөхөн сэргээлт /2018.06.04-2021.06.04/, Мах, махан бүтээгдэхүүний үйлдвэрлэл, худалдаа, Модон эдлэл үйлдвэрлэл, Мал аж ахуй, Цайны газар, ",1,"Сүрэнжав.Цэдэнсодном, ",Сүрэнжав.Цэдэнсодном,2006.02.28,"Сүрэнжав.Цэдэнсодном, ",2020-12-30
3016986,Хайрхан хөгжлийн дэд бүтэц,"Архангай, Хайрхан, 5-р баг, Өгөөмөр, 0",2022.09.22,"Мал аж ахуйн салбарын туслах үйл ажиллагаа, Хоёрдогч түүхий эд ангилан ялгах, Дулаан тохижилтын ажил үйлчилгээ, ",1,".Архангай Аймгийн Хайрхан Сумын Иргэдийн Төлөөлөгчдийн Хурал, ",Аюушжав.Цэрэнтогтох,2022.09.22,,
6009913,Сина мед,"Улаанбаатар, Хан-Уул, 15-р хороо, үйлдвэр чингисийн өргөн чөлөө, 50, 137 тоот",2015.10.08,"Гадаад худалдаа, ",1,"Дашдорж.Өнөрзол, ",Дашдорж.Өнөрзол,2020.05.14,"Дашдорж.Өнөрзол, ",2020-05-14
5410061,Таширын хүрээ,"Улаанбаатар, Баянзүрх, 22-р хороо, гэгээ хотхон, 186в-3 тоот",2010.09.28,"Цооног өрөмдөх, тоноглох, сэргээн засварлах /2019.02.27 - 2024.02.27/, Усны хайгуул, судалгаа явуулах /2020.11.30 - 2025.11.30/, Төлбөр эсвэл гэрээний үндсэн дээр хийгдэх бөөний худалдаа, ",1,"Дорждэрэм.Хэрлэн, ",Дорждэрэм.Хэрлэн,2014.05.23,"Дорждэрэм.Хэрлэн, ",2020-10-21
1015079,Монголын хөнгөн атлетикийн холбоо,"Улаанбаатар, Сүхбаатар, 7-р хороо, 11 хороолол, 6, 124 тоот",2017.03.14,"Хөнгөн атлетикийн спортыг хөгжүүлэх, уралдаан тэмцээн, сургалт семинар зохион байгуулах, судалгаа төсөл хөтөлбөр хэрэгжүүлэх, ижил зорилготой байгууллагатай хамтран ажиллах, ",2,"Лхасүрэн.Хүрэлбаатар, Чойжгаваа.Зоригтбаатар, ",Лувсанвандан.Болд,2018.09.21,,
5735467,Цахиртүмэн алтай,"Улаанбаатар, Сонгинохайрхан, 3-р хороо, бага наран 2-5, 13",2013.08.06,"Гадаад худалдаа, Барилгын засвар, засал чимэглэл, ",1,"Лааган.Хажидмаа, ",Лааган.Хажидмаа,2018.01.31,"Лааган.Хажидмаа, ",2020-10-16
5506255,Шунхлайговь,"Улаанбаатар, Хан-Уул, 2-р хороо, чингисийн өргөн чөлөө, Капитал хаус 3-р давхар",2011.08.22,"Шатахууны бөөний болон жижиглэн худалдаа, шатахуун хадгалах, тээвэрлэх, Төлбөр эсвэл гэрээний үндсэн дээр хийгдэх бөөний худалдаа, ",1,".Шунхлай Холдинг, ",Жагдагдагва.Мөнхнаран,2018.12.21,"Шунхлайговь.Эс Жи коммодитис, Шунхлайговь.Шунхлайговь, ",5506255
3493113,Энх-Өвгөдий,"Завхан, Тэлмэн, 6-р баг, Өвөгдий, сургуулийн хэсэг, 14",2011.04.19,"Фермийн үйл ажиллагаа, Газар тариалан, мал аж ахуй хослон эрхлэх үйл ажил, Хүнсний бөөний худалдаа, Дулааны эрчим хүч үйлдвэрлэл, түгээх /2022.11.05 - 2027.11.05/, Байрны түрээсийн үйлчилгээ, Хөдөө аж ахуйн түүхий эд зуучлан борлуулах, Барилга угсралт 2.1.1, 2.1.1'', 2.1.2, 2.2.1, 2.2.2 заалтын дагуу ажил үйлчилгээ эрхлэх тусгай зөвшөөрлийг 2017 оны 11 дүгээр сарын  29-ний өдрөөс таван жилийн хугацаатай бүртгэв. /2017.11.29 - 2022.11.29/, ",1,"Энхтөр.Төрболд, ",Энхтөр.Төрболд,2019.03.18,"Энхтөр.Төрболд, ",2021-05-07
3255468,Алтай усан спорт чийрэгжүүлэлтийн газар,"Говь-Алтай, Есөнбулаг, 1-р баг, Баянхайрхан, солонго, 0",2021.06.07,"Спортын бусад үйл ажиллагаа, ",1,,Дорж.Батбилэг,2023.02.06,,
6401457,Их булаг АТҮК,"Улаанбаатар, Чингэлтэй, 18-р хороо, яргайт 8, 121",2019.02.27,"Гадаад худалдаа, Мал аж ахуй, Фермерийн аж ахуй, Мах, махан бүтээгдэхүүний үйлдвэрлэл, худалдаа, Худалдааны зуучлал, Газар тариалан, ",1,"Шагдарсүрэн.Шижир, ",Шагдарсүрэн.Шижир,2019.02.27,"Шагдарсүрэн.Шижир, ",2020-10-07
5624282,Оргилтурбин инженеринг,"Улаанбаатар, Сонгинохайрхан, 40-р хороо, ногоочин 4, 17 тоот",2012.08.13,"Сэргээгдэх эрчим хүчний чиглэлээр зөвлөгөөр өгөх, Гадаад худалдаа, Сэргээгдэх эрчим хүчний тоног төхөөрөмжийн худалдаа, Сэргээгдэх эрчим хүчний тоног төхөөрөмжийн засвар, ",1,"Дангаа.Гандорж, ",Дангаа.Гандорж,2012.08.13,"Дангаа.Гандорж, ",2020-03-24
6295495,Шавдэн,"Улаанбаатар, Сонгинохайрхан, 6-р хороо, хмк, 3, 23",2018.04.06,"Барааны дэлгүүр, Цайны газар / - /, Хүнсний дэлгүүр, Гадаад худалдаа, ",1,"Болдбаатар.Алтангэрэл, ",Болдбаатар.Алтангэрэл,2018.04.06,"Болдбаатар.Алтангэрэл, ",2020-10-29
