Регистр,Нэр,Хаяг,Бүртгэсэн_огноо,Үйл_ажиллагааны_чиглэл,Хувьцаа_эзэмшигчийн_тоо,Хувьцаа_эзэмшигч_гишүүд,Итгэмжлэлгүйгээр_төлөөлөх_албан_тушаалтан,ИТАТ_бүртгэсэн_огноо,Эцсийн_Өмчлөгч,ЭӨ_бүртгэсэн_огноо
5118395,Драгонхолдинг,"Улаанбаатар, Сонгинохайрхан, 18-р хороо, москвагийн гудамж, Драгон центр",2007.02.14,"Аялал жуулчлал, Гадаад худалдаа, Амралтын газар, Барьцаалан зээлдүүлэх үйлчилгээ, ",1,"Баярт.Октябрь, ",Баярт.Октябрь,2016.09.27,"Баярт.Октябрь, ",2020-02-13
3507416,Их мянганы хишиг,"Завхан, Улиастай, 6-р баг, Өлзийт, 32 айлын 8 тоот",2020.01.03,"Хот хоорондын зорчигч тээврийн үйлчилгээ, Дулаан үйлдвэрлэл /2021.01.21 - 2026.01.21/, Хүнсний бүтээгдэхүүн худалдаа үйлчилгээ, Барилгын материалын худалдаа, Барилгын ажил 2.1, 6.3, 8.1 заалтын дагуу үйлчилгээ /2020.06.08 - 2025.06.08/, Хуурай замын ачаа тээвэр, Авто угаалга, ",1,"Доржтүвдэн.Цэрэндорж, ",Доржтүвдэн.Цэрэндорж,2020.01.03,"Доржтүвдэн.Цэрэндорж, ",2021-05-20
4141687,Нүхт дулаан,"Хөвсгөл, Мөрөн, 7-р баг, 13-р гудамж, 6-4 тоот",2017.10.24,"Гадаад худалдаа, ",2,"Лааган.Тэгшбаяр, Лааган.Шаравдорж, ",Гомбосүрэн.Доржпалам,2017.10.24,"Гомбосүрэн.Доржпалам, ",2020-10-08
3380734,Цотан сувд,"Дорнод, Хэрлэн, 7-р баг, Benus төв 01",2016.03.25,"Эх хүүхдийн үүдэн болон хэвтүүлэн эмчлэх тусламж үйлчилгээ, Гадаад худалдаа эрхлэх, ",1,"Бадарч.Алтанцэцэг, ",Бадарч.Алтанцэцэг,2016.03.25,"Бадарч.Алтанцэцэг, ",2020-10-20
3858375,Шардөрөлж,"Төв, Жаргалант, 4-р баг, Загдал, 1",2008.09.16,"Гадаад худалдаа, Газар тариалан эрхлэх үйл ажил, Үр тарианы гурил үйлдвэрлэл, ",2,"Жамбал.Төмөрхуяг, Бордух.Уранхас, ",Бордух.Уранхас,2009.07.24,"Бордух.Уранхас, Жамбал.Төмөрхуяг, ",2020-10-29
2104024,Ургамалсүлжээ,"Завхан, Улиастай, 1-р баг, Жинст, 0",2005.10.15,"Дулаан үйлдвэрлэх, Худалдаа, ",1,"Батэрдэнэ.Лхагвасүрэн, ",Батэрдэнэ.Лхагвасүрэн,2022.01.25,"Батэрдэнэ.Лхагвасүрэн, ",2022-01-25
6334423,Би Кэй Би констракшн,"Улаанбаатар, Сонгинохайрхан, 5-р хороо, баянгол 30, 5 тоот",2018.08.06,"Гадаад худалдаа, Барилгын материалын худалдаа, Барилгын засвар хийх, ",1,"Ганболд.Хатантуул, ",Ганболд.Хатантуул,2018.08.06,"Ганболд.Хатантуул, ",2020-12-30
5399262,Меланжсурвэй,"Улаанбаатар, Чингэлтэй, 3-р хороо, 54",2010.08.13,"Гадаад худалдаа, Геологи хайгуулын зөвлөгөө өгөх, Геофизикийн судалгаа / - /, Уул уурхайн тоног төхөөрөмжийн худалдаа, ",1,"Даваажав.Сүхбазар, ",Даваажав.Сүхбазар,2010.08.13,"Даваажав.Сүхбазар, ",2020-12-28
5304504,Донгойн-Уул,"Улаанбаатар, Баянгол, 6-р хороо, 12",2009.05.18,"Гадаад худалдаа, ",1,"Цэрэнсамбуу.Нарангэрэл, ",Цэрэнсамбуу.Нарангэрэл,2009.05.18,"Цэрэнсамбуу.Нарангэрэл, ",2020-12-21
6572588,Түмэн од труд,"Улаанбаатар, Баянгол, 15-р хороо, 3-р хороолол, энэбишийн гудамж, 23б, 97",2020.05.14,"Аялал жуулчлал, Онлайн худалдаа, Газар тариалан, Цайны газар, Мах, махан бүтээгдэхүүний худалдаа, Фермерийн аж ахуй, Орчуулгын үйлчилгээ, Мах, махан бүтээгдэхүүний үйлдвэрлэл, Мал аж ахуй, ",1,"Мөнхзаяа.Эрдэнэүйл, ",Мөнхзаяа.Эрдэнэүйл,2020.05.14,"Мөнхзаяа.Эрдэнэүйл, ",2020-05-14
2784734,Тун эрдэнэ фарма трейд,"Улаанбаатар, Сүхбаатар, 4-р хороо, 1 40 мянгат, 01 тоот",2007.05.10,"Эм, эмнэлгийн хэрэгсэл, биологийн идэвхт бүтээгдэхүүн импортлох, ханган нийлүүлэх /2016.03.20-2019.03.20/, Гоо сайхны барааны худалдаа, ",1,"Лувсандаваа.Сугирцэрэн, ",Лувсандаваа.Сугирцэрэн,2007.05.10,"Лувсандаваа.Сугирцэрэн, Лувсандаваа.Сугирцэрэн, ",2020-12-10
3564207,Нью арвай фүүд,"Өвөрхангай, Арвайхээр, 5-р баг, Арвайхээр, 234, 1",2017.11.15,"Бэлэн хүнс хоол үйлдвэрлэл, Барьцаалан зээлдүүлэх үйлчилгээ, Гадаад худалдаа, Сүү, сүүн бүтээгдэхүүний үйлдвэрлэл, ",1,"Намсрай.Байгалмаа, ",Намсрай.Байгалмаа,2020.02.11,"Намсрай.Байгалмаа, ",2020-02-11
2742322,Сүхбаатар нийтлэг үйлчилгээ,"Сүхбаатар, Баруун-Урт, 7-р баг, Аймгийн ЗДТГ-н байр, 113 тоот",2006.06.28,"Тоосгоны  худалдаа, Зочид буудлын үйлчилгээ, Барилгын тоосго үйлдвэрлэл, Амралт,тээврийн хэрэгслээр үйлчилгээ үзүүлэх, Төр захиргааны байгууллагад үзүүлэх үйлчилгээ, ",1,"Сугар.Адъяагарав, ",Жигжидсүрэн.Сүрэнхүү,2022.06.02,,
6070442,Ресенг мед,"Улаанбаатар, Баянзүрх, 8-р хороо, хилчин, 408, 69 тоот",2016.04.26,"Програм хангамжийн үйл ажиллагаа, Гадаад худалдаа, Эмнэлгийн багаж, тоног төхөөрөмжийн, дагалдах хэрэгсэл импортлох, ханган нийлүүлэх /2016.09.22 - 2019.09.22/, Аялал жуулчлал, Мэдээллийн технологийн үйл ажиллагаа, Лабораторийн урвалж, оношлуур импортлох, ханган нийлүүлэх /2016.09.22 - 2019.11.22/, ",1,"Ганхуяг.Идэрчулуун, ",Ганхуяг.Идэрчулуун,2018.11.29,"Ганхуяг.Идэрчулуун, ",2020-01-14
6813038,"Багахангай гэрэлтүүлэг, ногоон байгууламж","Улаанбаатар, Багахангай, 1-р хороо, Засаг даргын тамгын газар",2022.01.21,"Нийтийн эзэмшлийн гэрэлтүүлэг, ашиглалт, засвар үйлчилгээ, ногоон байгууламжийн усалгаа, арчилгаа, үйлчилгээ, үйлдвэрлэл ажил үйлчилгээ, ",1,".Багахангай Дүүргийн Засаг Даргын Тамгын Газар, ",Чоймбол.Батхуяг,2022.01.21,"Чоймбол.Батхуяг, ",2022-01-21
5607922,Эмэдюс,"Улаанбаатар, Сүхбаатар, 6-р хороо, бага тойруу, их сургуулийн, 8, 4 давхар тоот",2012.06.07,"Эм, эмнэлгийн хэрэгсэл, тоног төхөөрөмж ханган нийлүүлэх, импортлох, худалдах /2012.08.17 - 2023.08.31/, Төлбөр эсвэл гэрээний үндсэн дээр хийгдэх бөөний худалдаа, ",1,".Медмонгол, ",Нацагдорж.Буянхишиг,2022.05.04,"Балдангомбо.Цэнгэл, ",2020-02-05
4387015,Тоби-Ашиба,"Өмнөговь, Гурвантэс, 3-р баг, Тост, ,",2011.10.28,"Авто машинаар ачаа тээвэрлэх, Онлайн худалдаа, Фермерийн аж ахуй, Мах махан бүтээгдэхүүний үйлдвэрлэл, худалдаа, Барилгын засал чимэглэл, Төлбөр эсвэл гэрээний үндсэн дээр хийгдэх бөөний худалдаа, Цэцэрлэгжүүлэлт, Катерингийн үйлчилгээ, Аялал жуулчлал, Барилгын засвар, орчны тохижилт /2013.06.06 - 2016.06.06/, ",1,"Цогтсайхан.Адъяабазар, ",Цогтсайхан.Адъяабазар,2022.04.05,"Цогтсайхан.Адъяабазар, ",2022-04-05
6437397,Хийморилог эрч хүч,"Улаанбаатар, Сүхбаатар, 10-р хороо, 7 хороолол, 30б, 31 тоот",2019.05.27,"Дотоодод хөдөлмөр зуучлал, Мал аж ахуй, Гадаад худалдаа, Аялал, жуулчлал, Газар тариалан, ",1,"Хийрэв.Батамгалан, ",Хийрэв.Батамгалан,2019.05.27,,
4248961,Өсөх-Урам,"Дархан-Уул, Дархан, 9-р баг, 4 хороолол, өөрийн байр",2007.06.18,"Сэлбэгийн худалдаа, Сантехник цахилгааны засвар үйлчилгээ, Гадаад дотоод худалдаа, Авто зам барилга /2014.03.28 - 2017.03.28/, Барилга угсралтын ажил 2.1.1, 2.1.2, 2.1.3, 2.2.1, 2.2.2, 2.2.3, 2.3.3, / - /, Барилгын засал чимэглэл, Барилгын материалын жижиглэн худалдаа, ",1,"Ганзориг.Ундармаа, ",Алтансүх.Мөнхсүх,2019.03.29,"Ганзориг.Ундармаа, Ганзориг.Ундармаа, ",2020-03-06
2106663,Эрэн-Уул,"Булган, Тэшиг, , 1",2005.09.22,"Үр тариа болон бусад ургамал тариалалт, Хүнс, ундаа, тамхины төрөлжсөн дэлгүүрийн жижиглэн худалдаа, ",1,"Жамсранжав.Хүрэлбаатар, ",Шагдар.Саранцэцэг,2008.10.28,"Жамсранжав.Хүрэлбаатар, ",2021-01-08
3551261,Арвайншагшаа,"Өвөрхангай, Арвайхээр, 7-р баг, Дэлгэрэхийн дэнж, 26, 2 тоот",2007.05.31,"Гар урлал, оёдлын үйл ажиллагаа, Автомашины  сэлбэгийн худалдаа, Барилгын засварын  ажил, БА-3.3; 3.4; БА-6.1; БА-6.2; БА-6.3; БА-6.4-т заасан үйл ажиллагаа эрхлэх /2018.07.06 - 2023.07.06/, Барилга угсралт /2018.07.06 - 2023.07.06/, Барилгын материалын худалдаа, ",1,"Пүрэвсүрэн.Дэлгэрсайхан, ",Пүрэвсүрэн.Дэлгэрсайхан,2021.01.26,"Пүрэвсүрэн.Дэлгэрсайхан, ",2021-01-26
2606542,Хасүманал ар,"Архангай, Эрдэнэбулган, 1-р баг, 0",2005.10.24,"Уламжлалт эмчилгээ, зүү төөрнүүр, бариа засал , шавар тосон эмчилгээ /2000.02.24 - /, Доторын өвчинг оношлох, эмчлэх /2000.02.24 - /, Эм гоо сайхны бөөны худалдаа / - /, Эмэгтэйчүүд, дотрын эмнэлгийн эмчилгээ, оношилгоо, үйлчилгээ /2022.06.30 - 2027.06.30/, ",1,"Цэрэндорж.Мөнхцэцэг, ",Цэрэндорж.Мөнхцэцэг,2023.05.09,"Дөлгөөн-Арц.Хасүманал ар, Хасүманал ар.Хасүманал ар, ",2606542
5072166,ЧБГ,"Улаанбаатар, Баянгол, 17-р хороо, 21 тоот",2006.07.06,"Хүнсний дэлгүүр, Гадаад худалдаа, Хүнсний бөөний худалдаа, ",1,"Бүрнээбазар.Чинзориг, ",Бүрнээбазар.Чинзориг,2006.07.06,"Бүрнээбазар.Чинзориг, ",2020-07-02
3566862,Арвайхээр хотын нийтийн тээвэр гэрэлтүүлэг,"Өвөрхангай, Арвайхээр, 5-р баг, Арвайхээр, Хангамж 7",2020.02.05,"Хотын гэрэлтүүлгийн шинэчлэлт болон засвар арчлалт, Замын тэмдэг, тэмдэглэгээ хийх, автобусны буудал шинээр барих, засвар үйлчилгээ, Нийтийн тээврийн үйлчилгээ, Авто болон явган замын цэвэрлэгээ, ",1,".Өвөрхангай Аймгийн Арвайхээр Сумын Иргэдийн Төлөөлөгчдийн Хурал, ",Баттулга.Батэрдэнэ,2020.02.06,,
4422538,Орхон аймгийн тэшүүрийн холбоо,"Орхон, Баян-Өндөр, 3-р баг, Уурхайчин, Биеийн тамир спортын газрын Б заал",2022.12.27,"Нийтийн биеийн тамирыг хөгжүүлж, Монгол улсаа төлөөлж, тив, дэлхийн тавцанд нэрээ дуурсгах шилдэг тамирчдыг бэлтгэх зорилготой., ",0,,Бямбажав.Мөнхэрдэнэ,2022.12.27,"Бямбажав.Мөнхэрдэнэ, ",2022-12-27
6517749,Нарны эгшиг,"Улаанбаатар, Баянзүрх, 16-р хороо, 72 хотхон 1 байр 18 тоот",2020.01.10,"Байгаль орчинд үзүүлэх, сөрөг нөлөөллийг бууруулахад иргэд олон нийтийн оролцоог дээшлүүлэх , сургалт семинар зохион байгуулах, ижил зорилготой байгууллагатай хамтран ажиллах, ",3,"Түмэнцэрэн.Түмэнэрдэнэ, Бэхочир.Шагдар, Шагдар.Цолмонбаяр, ",Түмэнцэрэн.Түмэнэрдэнэ,2020.01.10,"Шагдар.Цолмонбаяр, ",2020-01-10
2109131,Хөвсгөл ренчин жугнай,"Хөвсгөл, Мөрөн, 8-р баг, 01",2006.10.24,"Эмнэлгийн газар эмчилгээ хийх үйл ажиллагаа /2005.06.01 - /, ",1,"Пүрэв.Эрдэнэчулуун, ",Пүрэв.Эрдэнэчулуун,2006.10.24,"Пүрэв.Эрдэнэчулуун, ",2020-09-28
3860493,Замтын булаг хайрхан,"Төв, Баянчандмань, 3-р баг, Эрдэнэ, 01",2010.08.26,"Мал аж ахуй, Зочид буудал,амралт,сувилал, Төлбөр эсвэл гэрээний үндсэн дээр хийгдэх бөөний худалдаа, ",1,"Шанзбаатар.Амарбаясгалан, ",Нанзад.Бямбасүрэн,2015.08.13,"Шанзбаатар.Амарбаясгалан, ",2020-10-07
2165171,Манай эмнэлэг өрхийн эрүүл мэндийн төв,"Улаанбаатар, Баянгол, 14-р хороо, 3-р хороолол, Өөрийн байр",2011.05.05,"Өрхийн эмнэлгийн үйл ажиллагаа /2018.04.24 - 2023.02.04/, Өрхийн эмнэлгийн үйл ажиллагаа /2015.04.24-2018.04.24/ /2015.04.24 - 2018.04.24/, ",8,"Гунгаадаш.Эрдэнэчимэг, Тэрбиш.Тунгалаг, Сүхбаатар.Эрдэнэгэрэл, Түвдэндорж.Мөнхтуяа, Ёндонжамц.Дарьсүрэн, Жүгдэр.Туул, Энхжаргал.Нансалмаа, Одхүү.Энхмөрөн, ",Ёндонжамц.Дарьсүрэн,2022.04.27,"Ёндонжамц.Дарьсүрэн, ",2021-06-10
5686741,Мастерпойнт,"Улаанбаатар, Баянзүрх, 6-р хороо, 13 хороолол, хд 54, 45",2013.03.21,"Фермерийн аж ахуй эрхлэх, Гадаад худалдаа, Авто машины засвар үйлчилгээ, ",2,"Батбаяр.Эрдэнэчулуун, Батмөнх.Уянга, ",Батбаяр.Эрдэнэчулуун,2013.03.21,"Батбаяр.Эрдэнэчулуун, ",2021-01-07
2026899,Баянгол зочид буудал,"Улаанбаатар, Сүхбаатар, 1-р хороо, 00",2006.01.13,"Гадаад худалдаа, Валют солих цэг ажиллуулах, Зочид буудал, Зоогийн газар, баарын үйлчилгээ /2017.08.15 - 2019.08.15/ / - /, ",1366,"Халтмаа.Баттулга, Эзэмшигчид.Бусад Хувьцаа, Донёд.Бадамдэлгэрэх, Билли Лим.Сан Пау, Халтмаа.Баттуул, .Баянгол Зочид Буудал, ",Халтмаа.Цэндбаяр,2008.02.26,"Халтмаа.Цэндбаяр, ",2020-10-09
3684431,Молцог илч,"Сүхбаатар, Наран, 3-р баг, Наранбулаг, 0",2022.04.06,"Сумын төвийн нийтийн эзэмшлийн гудамж талбайд мод тарих, арчлах, хамгаалах, шилжүүлэн суулгах, цэцэг зүлэг тарих, арчлах, Хариуцсан машин механизм, техник тоног төхөөрөмжийн засвар, үйлчилгээ, Хог хаягдлыг цуглуулах, ачиж тээвэрлэх, сумын төвийн хог хаягдлын төвлөрсөн цэгийн үйл ажиллагааг хариуцах, золбин нохой муурын устгал, Хот тохижилт, хашаа гудамжны хаягын бүрэн бүтэн байдлыг хангах, хүүхдийн тоглоомын талбайн арчлалт, хамгаалалт, нийтийн эзэмшлийн эд, аж ахуйг засварлах, шинэчлэх, нэмэгдүүлэх хөтөлбөр боловсруулан хэрэгжүүлэх, Гэрэлтүүлгийн нэгдсэн удирдлага, хяналт, ",1,".Сүхбаатар Аймгийн Наран Сумын Иргэдийн Төлөөлөгчдийн Хурал, ",Төмөр.Дэлгэрцогт,2022.04.06,,
3765164,Илдэн бүрэн,"Сэлэнгэ, Зүүнбүрэн, 1-р баг, Жаргалант, 2 хэсэг, Төрийн үйлчилгээний нэгдсэн төв байрны 2 давхарт",2021.04.05,"Сумын төвийн нийтийн эзэмшлийн гудамж талбай, авто зам төвлөрсөн цэгийн хог хаягдлыг цэвэрлэх, ачиж тээвэрлэх, гудамжны гэрэлтүүлгийн ашиглалт, тохижилт үйлчилгээ, сумын халаалтын зуух, нийтийн халуун усны үйлчилгээ эрхлэх, Барилгын материалын үйлдвэрлэл, ",1,".Сэлэнгэ Аймгийн Зүүнбүрэн Сумын Иргэдийн Төлөөлөгчдийн Хурал, ",Цэдэн.Батмөнх,2021.04.05,,
4123581,Туурайн тамга,"Хөвсгөл, Мөрөн, 3-р баг, 4, -р гудамж 08 тоот",2007.04.11,"Тээвэр зохицуулалт, аялал, жуулчлалд үйлчлэх үйл ажиллагаа, Гэрээ, захиалгаар хийдэг бөөний худалдаа, Зуух, даралтат сав, шугам хоолойн угсралт, засвар үйлчилгээ /2006.03.25 - /, ",1,"Гомбожав.Цээпил, ",Гомбожав.Цээпил,2021.11.25,"Гомбожав.Цээпил, ",2021-11-25
5883776,Мегатитан,"Улаанбаатар, Баянгол, 1-р хороо,  Газар бизнес  төв 3-р давхар",2014.09.22,"Мах, махан бүтээгдэхүүний худалдаа, Гадаад худалдаа, Газар тариалан эрхлэх, Авто зам замын байгууламжийг барих, засварлах /2019.12.02 - 2022.12.02/, Барилгын засвар хийх, Барьцаалан зээлдүүлэх үйлчилгээ, ",2,"Хамхаш.Асылбек, Уранчимэг.Пүрэвсүрэн, ",Уранчимэг.Пүрэвсүрэн,2014.09.23,"Уранчимэг.Пүрэвсүрэн, Хамхаш.Асылбек, ",2022-09-13
2729822,Аксу-Алтай,"Говь-Алтай, Есөнбулаг, 2-р баг, Баяншанд, 0",2008.11.17,"Гадаад худалдаа, ",1,"Сэрод.Цэрэндолгор, ",Сэрод.Цэрэндолгор,2019.06.06,,
6371612,Тэгш дүүрэн арвидах,"Улаанбаатар, Сүхбаатар, 6-р хороо, их тойруу, 10а, 72 тоот",2018.11.23,"Газар тариалан, Мал аж ахуй, Барилгын засвар хийх, ",1,"Бор.Одгэрэл, ",Бор.Одгэрэл,2018.11.23,"Бор.Одгэрэл, ",2020-10-17
3253961,Нэмүүц алтай,"Говь-Алтай, Чандмань, 2-р баг, Өлзийбулаг, 0",2020.01.13,"Шатахууны жижиглэн худалдаа, ",1,"Дамчаа.Нянцандаш, ",Дамчаа.Нянцандаш,2020.01.13,"Дамчаа.Нянцандаш, ",2020-01-13
2593785,Төхөмфарм,"Улаанбаатар, Чингэлтэй, 1-р хороо, 87",2007.05.09,"Гадаад худалдаа, Эм найруулах,эм барих /2005.12.20 - /, ",1,"Дагвадорж.Болормаа, ",Дагвадорж.Болормаа,2007.05.09,"Дагвадорж.Болормаа, ",2020-08-19
3197867,Баян нутгийн илч,"Булган, Баяннуур, 1-р баг, Өлзийт, 0",2020.01.17,"Дулаан түгээх үйлчилгээ / - /, ",1,"Давааноров.Батсуурь, ",Давааноров.Батсуурь,2020.01.17,"Давааноров.Батсуурь, ",2020-01-17
2736012,Дархан-Ус суваг,"Дархан-Уул, Дархан, 8-р баг, 0 тоот",2006.07.27,"Гадаад дотоод худалдаа, зуучлал / - /, Нийтийн аж ахуй /2009.10.09 - 2014.10.09/, Ус хуримтлуулан ариутгаж түгээх, бохир усыг татан зайлуулж цэвэрлэх үйл ажиллагаа, Барилга угсралтын ажил /2010.02.11 - 2015.02.11/, ",1,"Содномбалжир.Элбэгбаян, ",Гомбожав.Эрдэнэбат,2020.12.07,"Гомбожав.Эрдэнэбат, ",2020-12-07
5737125,Вокомтехнологи,"Улаанбаатар, Баянзүрх, 16-р хороо, цис3 7 тоот",2013.08.09,"Вэб сайтын үйлчилгээ, Програм хангамжийн үйл ажиллагаа, Гадаад худалдаа, Уул уурхайн чиглэлээр зөвлөгөө өгөх, Хэвлэлийн эх бэлтгэх, Мэдээлэл технологийн үйл ажиллагаа, Онлайн худалдаа, Уран сайхны болон баримтат кино хийх, Барилгын засвар хийх, Дуу дүрс бичлэг хийх, Дохиолол, хяналтын камер суурилуулах, Газар тариалан, Компьютер, түүний дагалдах  тоног төхөөрөмжийн худалдаа, ",2,".Вокомгрупп, Төмөртогоо.Баатарсүрэн, ",Батмөнх.Ууганбаяр,2013.08.09,"Батмөнх.Ууганбаяр, ",2022-12-16
2719541,Саннисервис,"Улаанбаатар, Чингэлтэй, 6-р хороо, 49 тоот",2007.05.09,"Гадаад худалдаа, Барилгын материалын худалдаа, ",2,"Цагаанбаатар.Чинзориг, Цагаанбаатар.Ариунзаяа, ",Цагаанбаатар.Ариунзаяа,2018.04.24,"Цагаанбаатар.Чинзориг, ",2020-10-14
4124545,Гангабуудай,"Хөвсгөл, Тариалан, 1-р баг, Мандал, 0",2008.04.08,"Үр тариа болон бусад ургамал тариалалт, Үр тарианы гурил үйлдвэрлэл, Бөөний худалдааны бусад / - /, ",1,".Гангабуудай, ",Санжсүрэн.Батмагнай,2008.04.25,"Санжсүрэн.Батмагнай, ",2020-09-10
4286103,ЭХНБ дархан,"Дархан-Уул, Дархан, 16-р баг, 1 хороолол, 8, 23",2021.02.22,"Худалдаа үйлчилгээ, ",2,"Амгалан.Энэрэл, Ариунболд.Чинсанаа, ",Төмөрбаатар.Аззаяа,2021.02.22,"Амгалан.Энэрэл, Ариунболд.Чинсанаа, ",2021-02-22
2660245,Бамбайфарма,"Орхон, Баян-Өндөр, 5-р баг, Уртбулаг, 5 хороолол, 1, 89 тоот",2005.09.29,"Эм импортлох болон ханган нийлүүлэх, Эмийн худалдаа / - /, ",1,"Жамъяншарав.Байгальмаа, ",Жамъяншарав.Байгальмаа,2005.09.29,"Жамъяншарав.Байгальмаа, ",2020-03-10
2132311,Мижарс,"Сүхбаатар, Баруун-Урт, 4-р баг, Нарлаг 3-315А",2006.07.28,"Эмнэлгийн газар эмчилгээ хийх үйл ажиллагаа /2005.05.05 - /, ",1,"Сономжамц.Жанчив, ",Сономжамц.Жанчив,2021.03.01,"Сономжамц.Жанчив, ",2021-03-01
